sentence,tree,is_sent
Zum Beispiel Telefongespräche und Internetdaten.,(NP (PP (APPRART Zum) (NN Beispiel)) (CNP (NN Telefongespräche) (KON und) (NN Internetdaten))) ($. .),False
Die Technik von Echelon steht auch in Deutschland.,(S (NP (ART Die) (NN Technik) (PP (APPR von) (NE Echelon))) (VVFIN steht) (PP (ADV auch) (APPR in) (NE Deutschland))) ($. .),True
"Zum Beispiel gab es in in Bad Aibling, Bayern diese Abhörtechnik.","(S (PP (APPRART Zum) (NN Beispiel)) (VVFIN gab) (PPER es) (APPR in) (APPR in) (PN (NE Bad) (NE Aibling))) ($, ,) (PP (NE Bayern)) (NP (PDAT diese) (NN Abhörtechnik)) ($. .)",True
Die Geheimdienste und die Regierungen der 5 Länder haben lange nichts gesagt.,(S (NP (CNP (NP (ART Die) (NN Geheimdienste)) (KON und) (NP (ART die) (NN Regierungen))) (NP (ART der) (CARD 5) (NN Länder))) (VAFIN haben) (VP (ADV lange) (PIS nichts) (VVPP gesagt))) ($. .),True
Oder sie haben gelogen.,(S (KON Oder) (PPER sie) (VAFIN haben) (VVPP gelogen)) ($. .),True
"Sie haben gesagt, Echelon gibt es nicht.","(S (PPER Sie) (VAFIN haben) (VP (VVPP gesagt))) ($, ,) (S (NE Echelon) (VVFIN gibt) (PPER es) (PTKNEG nicht)) ($. .)",True
"Seit dem Jahr 2002 wissen alle, dass es Echelon gibt.","(S (PP (APPR Seit) (ART dem) (NN Jahr) (CARD 2002)) (VVFIN wissen) (PIS alle)) ($, ,) (S (KOUS dass) (PPER es) (NN Echelon) (VVFIN gibt)) ($. .)",True
Echelon gibt es wahrscheinlich seit dem Jahr 1970. \newline  \newline Mit den abgehörten Daten sollen Terroristen und Drogendealer geschnappt werden.,(S (NN Echelon) (VVFIN gibt) (PPER es) (ADJD wahrscheinlich) (APPR seit) (ART dem) (NN Jahr)) ($. 1970.),True
Mit Echelon wird auch Wirtschaftsspionage gemacht.,(S (PP (APPR Mit) (NE Echelon)) (VAFIN wird) (NP (ADV auch) (NN Wirtschaftsspionage)) (VP (VVPP gemacht))) ($. .),True
Das heißt es werden Informationen von Firmen geklaut.,(S (PDS Das) (VVFIN heißt) (S (PPER es) (VAFIN werden) (NN Informationen) (VP (PP (APPR von) (NN Firmen)) (VVPP geklaut)))) ($. .),True
Diese Informationen bekommen dann andere Firmen.,(S (NP (PDAT Diese) (NN Informationen)) (VVFIN bekommen) (ADV dann) (NP (ADJA andere) (NN Firmen))) ($. .),True
Die Regierungen und Geheimdienste benutzen Echelon auch um Gesetze auszutricksen.,(S (NP (ART Die) (CNP (NN Regierungen) (KON und) (NN Geheimdienste))) (VVFIN benutzen) (NN Echelon) (VP (ADV auch) (KOUI um) (NN Gesetze) (VVIZU auszutricksen))) ($. .),True
Zum Beispiel darf der Geheimdienst in den USA die Bürger nicht ausspionieren.,(S (PP (APPRART Zum) (NN Beispiel)) (VMFIN darf) (NP (ART der) (NN Geheimdienst) (PP (APPR in) (ART den) (NE USA))) (NP (ART die) (NN Bürger)) (PTKNEG nicht) (VP (VVINF ausspionieren))) ($. .),True
Das macht dann der Geheimdienst von Großbritannien.,(S (PDS Das) (VVFIN macht) (ADV dann) (NP (ART der) (NN Geheimdienst) (PP (APPR von) (NE Großbritannien)))) ($. .),True
"Der gibt dann die Daten an den Geheimdienst der USA. \newline Der Geheimdienst der USA gibt die gesammelten Daten der Bürger von Großbritannien, \newline dem Geheimdienst von Großbritannien.",(S (PDS Der) (VVFIN gibt) (ADV dann) (NP (ART die) (NN Daten)) (PP (APPR an) (ART den) (NN Geheimdienst) (NP (ART der) (NE USA)))) ($. .),True
Diesen Trick benutzten die Geheimdienste auch bei anderen Abhörtechniken.,(S (NP (PDAT Diesen) (NN Trick)) (VVFIN benutzten) (NP (ART die) (NN Geheimdienste)) (PP (ADV auch) (APPR bei) (ADJA anderen) (NN Abhörtechniken))) ($. .),True
Zum Beispiel bei PRISM und Tempora,(PP (PP (APPRART Zum) (NN Beispiel)) (APPR bei) (CNP (NE PRISM) (KON und) (NE Tempora))),False
Echelon ist der Name von einem Spionagenetz.,(S (NE Echelon) (VAFIN ist) (NP (ART der) (NN Name) (PP (APPR von) (ART einem) (NN Spionagenetz)))) ($. .),True
Mit dem Spionagenetz werden Satelliten überwacht.,(S (PP (APPR Mit) (ART dem) (NN Spionagenetz)) (VAFIN werden) (NN Satelliten) (VP (VVPP überwacht))) ($. .),True
"Das heißt: Alles was über Satellit gemacht wird, \newline wird von den Nachrichtendiensten abgehört.","(S (PDS Das) (VVFIN heißt)) ($. :) (NP (PIS Alles) (S (PRELS was) (VP (PP (APPR über) (NN Satellit)) (VVPP gemacht)) (VAFIN wird))) ($, ,) (S (FM \newline) (VAFIN wird) (VP (PP (APPR von) (ART den) (NN Nachrichtendiensten)) (VVPP abgehört))) ($. .)",True
Der Echte Clown-fisch wird ungefähr 11 Zentimenter lang.,(S (NP (ART Der) (ADJA Echte) (NN Clown-fisch)) (VAFIN wird) (AP (NP (AP (ADV ungefähr) (CARD 11)) (NN Zentimenter)) (ADJD lang))) ($. .),True
Ein Clown-fisch lebt ungefähr 8 bis 10 Jahre lang.,(S (NP (ART Ein) (NN Clown-fisch)) (VVFIN lebt) (AP (NP (AP (ADJD ungefähr) (CAP (CARD 8) (KON bis) (CARD 10))) (NN Jahre)) (ADJD lang))) ($. .),True
Manche sagen zum Echten Clown-fisch auch Anemonen-fisch.,(S (PIS Manche) (VVFIN sagen) (PP (APPRART zum) (ADJA Echten) (NN Clown-fisch)) (NP (ADV auch) (NN Anemonen-fisch))) ($. .),True
Es gibt 27 verschiedene Clown-fisch-arten.,(S (PPER Es) (VVFIN gibt) (NP (CARD 27) (ADJA verschiedene) (NN Clown-fisch-arten))) ($. .),True
Zum Beispiel der Echte Clown-fisch.,(NP (PP (APPRART Zum) (NN Beispiel)) (ART der) (ADJA Echte) (NN Clown-fisch)) ($. .),False
Anemonen-fische leben in einer Anemone.,(S (NN Anemonen-fische) (VVFIN leben) (PP (APPR in) (ART einer) (NN Anemone))) ($. .),True
Anemonenfische und Anemonen leben in einer Symbiose.,(S (CNP (NN Anemonenfische) (KON und) (NN Anemonen)) (VVFIN leben) (PP (APPR in) (ART einer) (NN Symbiose))) ($. .),True
"Das heißt, sie leben zusammen.","(S (PDS Das) (VVFIN heißt)) ($, ,) (S (PPER sie) (VVFIN leben) (ADV zusammen)) ($. .)",True
Und helfen sich gegenseitig.,(S (KON Und) (VVFIN helfen) (PRF sich) (ADJD gegenseitig)) ($. .),True
Bei Gefahr verstecken sie sich die Clown-fische in der Anemone.,(S (PP (APPR Bei) (NN Gefahr)) (VVFIN verstecken) (PPER sie) (PRF sich) (NP (ART die) (NN Clown-fische)) (PP (APPR in) (ART der) (NN Anemone))) ($. .),True
Die Anemone hat nesselnde Tentakel.,(S (NP (ART Die) (NN Anemone)) (VAFIN hat) (NP (ADJA nesselnde) (NN Tentakel))) ($. .),True
Das heißt man kann sich an den Tentakeln verbrennen.,(S (PDS Das) (VVFIN heißt) (S (PIS man) (VMFIN kann) (VP (PRF sich) (PP (APPR an) (ART den) (NN Tentakeln)) (VVINF verbrennen)))) ($. .),True
So ähnlich wie an einer Brennesel.,(AP (AVP (ADV So)) (ADJD ähnlich) (PP (KOKOM wie) (APPR an) (ART einer) (NN Brennesel))) ($. .),False
Der Clown-fisch hat eine besondere Haut.,(S (NP (ART Der) (NN Clown-fisch)) (VAFIN hat) (NP (ART eine) (ADJA besondere) (NN Haut))) ($. .),True
Auf der Haut ist eine Schleim-schicht.,(S (PP (APPR Auf) (ART der) (NN Haut)) (VAFIN ist) (NP (ART eine) (NN Schleim-schicht))) ($. .),True
Die Schleimschicht schützt den Clown-fisch vor den Tentaklen.,(S (NP (ART Die) (NN Schleimschicht)) (VVFIN schützt) (NP (ART den) (NN Clown-fisch)) (PP (APPR vor) (ART den) (NN Tentaklen))) ($. .),True
Manche Fische fressen Anemonen.,(S (NP (PIAT Manche) (NN Fische)) (VVFIN fressen) (NN Anemonen)) ($. .),True
Zum Beispiel der Falter-fische.,(NP (PP (APPRART Zum) (NN Beispiel)) (ART der) (NN Falter-fische)) ($. .),False
Der Clown-fisch beschützt dann die Anemone.,(S (NP (ART Der) (NN Clown-fisch)) (VVFIN beschützt) (ADV dann) (NP (ART die) (NN Anemone))) ($. .),True
Der Clown-fisch verjagt die anderen Fische.,(S (NP (ART Der) (NN Clown-fisch)) (VVFIN verjagt) (NP (ART die) (ADJA anderen) (NN Fische))) ($. .),True
Clown-fische legen Eier.,(S (NN Clown-fische) (VVFIN legen) (NN Eier)) ($. .),True
Das Weibchen legt ungefähr 500 Eier ab.,(S (NP (ART Das) (NN Weibchen)) (VVFIN legt) (NP (AP (ADJD ungefähr) (CARD 500)) (NN Eier)) (PTKVZ ab)) ($. .),True
Meistens am Fuß von der Anemone.,(S (PP (ADV Meistens) (PP (APPRART am) (NN Fuß))) (PP (APPR von) (ART der) (NN Anemone))) ($. .),False
Dann kümmert sich das Männchen um die Eier.,(S (ADV Dann) (VVFIN kümmert) (PRF sich) (NP (ART das) (NN Männchen)) (PP (APPR um) (ART die) (NN Eier))) ($. .),True
Aus den Eiern schlüpfen dann Jung-fische.,(S (PP (APPR Aus) (ART den) (NN Eiern)) (VVFIN schlüpfen) (ADV dann) (NN Jung-fische)) ($. .),True
Die Jung-fische sind alle Männchen.,(S (NP (ART Die) (NN Jung-fische)) (VAFIN sind) (NP (PIAT alle) (NN Männchen))) ($. .),True
Manche werden später Weibchen.,(S (PIS Manche) (VAFIN werden) (ADJD später) (NN Weibchen)) ($. .),True
Anemonen-fische leben meistens als Paar in einer Anemone.,(S (NN Anemonen-fische) (VVFIN leben) (ADV meistens) (PP (APPR als) (NN Paar)) (PP (APPR in) (ART einer) (NN Anemone))) ($. .),True
Oder in einem Harem.,(S (KON Oder) (PP (APPR in) (ART einem) (NN Harem))) ($. .),False
Das heißt: \newline Mehrere männliche Fische leben mit einem Weibchen zusammen.,(S (PDS Das) (VVFIN heißt)) ($. :) (NE \newline),True
"Stirbt das Weibchen, \newline wird ein Männchen aus der Gruppe zum Weibchen.","(S (VVFIN Stirbt) (NP (ART das) (NN Weibchen))) ($, ,) (S (ADV \newline) (VAFIN wird) (NP (ART ein) (NN Männchen) (PP (APPR aus) (ART der) (NN Gruppe))) (PP (APPRART zum) (NN Weibchen))) ($. .)",True
Der Echte Clown-fisch lebt im Meer.,(S (NP (ART Der) (ADJA Echte) (NN Clown-fisch)) (VVFIN lebt) (PP (APPRART im) (NN Meer))) ($. .),True
Zum Beispiel im Great Barrier Reef.,(PP (PP (APPRART Zum) (NN Beispiel)) (APPRART im) (PN (NE Great) (NE Barrier) (NE Reef))) ($. .),False
Der Echte Clown-fisch hat eine leuchtende orange Farbe.,(S (NP (ART Der) (ADJA Echte) (NN Clown-fisch)) (VAFIN hat) (NP (ART eine) (ADJA leuchtende) (ADJA orange) (NN Farbe))) ($. .),True
Auf dem Orange sind 3 weiße Streifen.,(S (PP (APPR Auf) (ART dem) (NN Orange)) (VAFIN sind) (NP (CARD 3) (ADJA weiße) (NN Streifen))) ($. .),True
Die Streifen haben einen schwarzen Rand.,(S (NP (ART Die) (NN Streifen)) (VAFIN haben) (NP (ART einen) (ADJA schwarzen) (NN Rand))) ($. .),True
Der Eco-Marathon ist ein Auto-Rennen.,(S (NP (ART Der) (NN Eco-Marathon)) (VAFIN ist) (NP (ART ein) (NN Auto-Rennen))) ($. .),True
Das Auto das am wenigsten Energie (zum Beispiel Benzin) verbraucht gewinnt.,(NP (ART Das) (NN Auto)) (ART das) (AA (PTKA am) (PIAT wenigsten)) (NN Energie) ($LRB -LRB-) (NP (NP (PP (APPRART zum) (NN Beispiel)) (NN Benzin))) ($LRB -RRB-) (S (VP (VVFIN verbraucht)) (VVFIN gewinnt)) ($. .),True
Edgar Allan Poe kommt am 19. Januar 1809 auf die Welt.,(S (PN (NE Edgar) (NE Allan) (NE Poe)) (VVFIN kommt) (PP (APPRART am) (ADJA 19.) (NN Januar) (CARD 1809)) (PP (APPR auf) (ART die) (NN Welt))) ($. .),True
"In Boston, Massachusetts, USA. \newline Er stirbt am 7. Oktober 1849. \newline In Baltimore, Maryland, USA. \newline  \newline Poe hat großen Einfluss auf spätere Schrift-steller.","(APPR In) (NE Boston) ($, ,) (NE Massachusetts) ($, ,) (PP (NE USA)) ($. .)",False
Edgar Allan Poe schreibt vor allem: • Kurz-geschichten,(S (PN (NE Edgar) (NE Allan) (NE Poe)) (VVFIN schreibt) (PP (APPR vor) (PIS allem))) ($. :) (XY •) (NN Kurz-geschichten),True
Edgar Allan Poe schreibt vor allem: • Kriminal-geschichten,(S (PN (NE Edgar) (NE Allan) (NE Poe)) (VVFIN schreibt) (PP (APPR vor) (PIS allem))) ($. :) (XY •) (NP (NN Kriminal-geschichten)),True
Edgar Allan Poe schreibt vor allem: • Horror und Schauer-geschichten,(S (PN (NE Edgar) (NE Allan) (NE Poe)) (VVFIN schreibt) (PP (APPR vor) (PIS allem))) ($. :) ($LRB •) (CNP (NN Horror) (KON und) (NN Schauer-geschichten)),True
Die Geschichten von Poe beeinflussen Jules Verne.,(S (NP (ART Die) (NN Geschichten) (PP (APPR von) (NE Poe))) (VVFIN beeinflussen) (PN (NE Jules) (NE Verne))) ($. .),True
Verne ist einer der ersten Science-Fiction Schrift-steller.,(S (NE Verne) (VAFIN ist) (NP (PIS einer) (NP (ART der) (ADJA ersten) (NN Science-Fiction) (NN Schrift-steller)))) ($. .),True
Poe hat auch großen Einfluss auf Charles Baudelaire.,(S (NE Poe) (VAFIN hat) (ADV auch) (ADJA großen) (NN Einfluss) (PP (APPR auf) (PN (NE Charles) (NE Baudelaire)))) ($. .),True
Baudelaire gebraucht Poesie von Poe in Vorträgen.,(S (NE Baudelaire) (VVFIN gebraucht) (NP (NN Poesie) (PP (APPR von) (NE Poe))) (PP (APPR in) (NN Vorträgen))),True
Und erschafft damit die Grundlage vom: \newline Symbolismus \newline Moderne Dichtung,(S (KON Und) (VVFIN erschafft) (PROAV damit) (NP (ART die) (NN Grundlage) (APPRART vom))) ($. :),True
Edgar Allan Poe war ein Schrift-steller.,(S (PN (NE Edgar) (NE Allan) (NE Poe)) (VAFIN war) (NP (ART ein) (NN Schrift-steller))) ($. .),True
Er hat Horror-geschichten geschrieben.,(S (PPER Er) (VAFIN hat) (VP (NN Horror-geschichten) (VVPP geschrieben))) ($. .),True
"Edward Snowden  wurde am 21. Juni 1983 in Elizabeth City, USA geboren.","(S (PN (NE Edward) (NE Snowden)) (VAFIN  ) (VAFIN wurde) (PP (APPRART am) (ADJA 21.) (NN Juni) (CARD 1983)) (APPR in) (PN (NE Elizabeth) (NE City))) ($, ,) (VP (PP (NE USA)) (VVPP geboren)) ($. .)",True
Edward Snowden hat eine ältere Schwester.,(S (PN (NE Edward) (NE Snowden)) (VAFIN hat) (NP (ART eine) (ADJA ältere) (NN Schwester))) ($. .),True
Er hat am Anne Arundel Community College in Maryland Informatik studiert.,(S (PPER Er) (VAFIN hat) (VP (PP (APPRART am) (PN (NE Anne) (NE Arundel) (NE Community) (NE College)) (PP (APPR in) (NE Maryland))) (NN Informatik) (VVPP studiert))) ($. .),True
Er hat nicht fertig studiert.,(S (PPER Er) (VAFIN hat) (VP (AP (PTKNEG nicht) (ADJD fertig)) (VVPP studiert))) ($. .),True
Danach hat er als Computer Techniker für Geheimdienste gearbeitet.,(S (PROAV Danach) (VAFIN hat) (PPER er) (VP (PP (APPR als) (NN Computer) (NN Techniker)) (PP (APPR für) (NN Geheimdienste)) (VVPP gearbeitet))) ($. .),True
Zum Beispiel in Japan auf einer amerikanischen Militärbasis.,(S (PP (PP (APPRART Zum) (NN Beispiel)) (PP (APPR in) (NE Japan))) (PP (APPR auf) (ART einer) (ADJA amerikanischen) (NN Militärbasis))) ($. .),False
Bei seiner Arbeit bei den Geheimdiensten hat er die Geheimdienstprogramme PRISM und Tempora gesehen.,(S (PP (APPR Bei) (PPOSAT seiner) (NN Arbeit) (PP (APPR bei) (ART den) (NN Geheimdiensten))) (VAFIN hat) (PPER er) (VP (NP (ART die) (NN Geheimdienstprogramme) (CNP (NE PRISM) (KON und) (NE Tempora))) (VVPP gesehen))) ($. .),True
Edward Snowden ist der Meinung dass PRISM und Tempora nicht rechtmäßig sind.,(PN (NE Edward) (NE Snowden)) (VAFIN ist) (ART der) (NN Meinung) (NP (S (KOUS dass) (CNP (NN PRISM) (KON und) (NN Tempora)) (PTKNEG nicht) (ADJD rechtmäßig) (VAFIN sind))) ($. .),True
"Das heißt, er glaubt die Geheimdienste halten sich nicht an Gesetze.","(S (PDS Das) (VVFIN heißt)) ($, ,) (S (PPER er) (VVFIN glaubt) (S (NP (ART die) (NN Geheimdienste)) (VVFIN halten) (PRF sich) (PTKNEG nicht) (PP (APPR an) (NN Gesetze)))) ($. .)",True
Deshalb hat er der Zeitung über PRISM und Tempora erzählt.,(S (PROAV Deshalb) (VAFIN hat) (PPER er) (VP (NP (ART der) (NN Zeitung)) (PP (APPR über) (CNP (NE PRISM) (KON und) (NN Tempora))) (VVPP erzählt))) ($. .),True
Er hat das einem Journalisten erzählt.,(S (PPER Er) (VAFIN hat) (VP (PDS das) (NP (ART einem) (NN Journalisten)) (VVPP erzählt))) ($. .),True
"Der Journalist heißt: Glenn Greenwald \newline Glenn Greenwald arbeitet für die Zeitung Guardian \newline Edward Snowden hat gesagt: \newline ""Ich möchte nicht in einer Welt leben, in der alles, was ich tue und sage, aufgezeichnet wird.",(S (NP (ART Der) (NN Journalist)) (VVFIN heißt)) ($. :) (NE Glenn) (NE Greenwald) (NE \newline),True
"Das ist nichts, was ich unterstützen oder wo ich leben möchte.""","(S (PDS Das) (VAFIN ist) (PIS nichts)) ($, ,) (NP (CS (S (PRELS was) (PPER ich) (VVFIN unterstützen)) (KON oder) (S (PWAV wo) (PPER ich) (VP (VVINF leben)) (VMFIN möchte)))) ($. .) ($LRB "")",True
Edward Snowden ist ein Computer System Administrator.,(S (PN (NE Edward) (NE Snowden)) (VAFIN ist) (NP (ART ein) (NN Computer) (FM System) (FM Administrator))) ($. .),True
Er hat für die Geheimdienste CIA und NSA gearbeitet.,(S (PPER Er) (VAFIN hat) (VP (PP (APPR für) (ART die) (NN Geheimdienste) (CNP (NE CIA) (KON und) (NE NSA))) (VVPP gearbeitet))) ($. .),True
Er ist auch ein Whistleblower.,(S (PPER Er) (VAFIN ist) (NP (ADV auch) (ART ein) (NN Whistleblower))) ($. .),True
Jemand der Egalitarismus gut findet ist Egalitär.,(S (S (PWS Jemand) (PRELS der) (NN Egalitarismus) (ADJD gut) (VVFIN findet)) (VAFIN ist) (NN Egalitär)) ($. .),True
Ein sehr bekannter war Rousseau.,(S (NP (ART Ein) (AP (ADV sehr) (ADJA bekannter))) (VAFIN war) (NE Rousseau)) ($. .),True
Es ist auch eine politische Idee.,(S (PPER Es) (VAFIN ist) (NP (ADV auch) (ART eine) (ADJA politische) (NN Idee))) ($. .),True
Eine Idee wie Menschen zusammen-leben können.,(ART Eine) (NN Idee) (S (PWAV wie) (NN Menschen) (VP (VVINF zusammen-leben)) (VMFIN können)) ($. .),True
Menschen können in einer Egalitären Gesellschaft zusammen-leben.,(S (NN Menschen) (VMFIN können) (VP (PP (APPR in) (ART einer) (ADJA Egalitären) (NN Gesellschaft)) (VVINF zusammen-leben))) ($. .),True
Da sollen alle gleich behandelt werden.,(S (ADV Da) (VMFIN sollen) (PIS alle) (VP (VP (ADJD gleich) (VVPP behandelt)) (VAINF werden))) ($. .),True
Und jeder soll die gleichen Chancen haben.,(S (KON Und) (PIS jeder) (VMFIN soll) (VP (NP (ART die) (ADJA gleichen) (NN Chancen)) (VAINF haben))) ($. .),True
"Egalitarismus ist, wenn man an Gleichheit glaubt.","(S (NN Egalitarismus) (VAFIN ist)) ($, ,) (S (KOUS wenn) (PIS man) (PP (APPR an) (NN Gleichheit)) (VVFIN glaubt)) ($. .)",True
"Zum Beispiel, dass jeder Mensch die gleichen Chancen hat.","(PP (APPRART Zum) (NN Beispiel)) ($, ,) (S (KOUS dass) (NP (PIAT jeder) (NN Mensch)) (NP (ART die) (ADJA gleichen) (NN Chancen)) (VAFIN hat)) ($. .)",True
Und alle Menschen gleich behandelt werden.,(S (KON Und) (NP (PIAT alle) (NN Menschen)) (VP (ADJD gleich) (VVPP behandelt)) (VAFIN werden)) ($. .),True
Der Mann der das Flugzeug entführt hat heißt: Saif a-Din Mustafa.,(S (ART Der) (NN Mann) (S (S (PRELS der) (VP (NP (ART das) (NN Flugzeug)) (VVPP entführt)) (VAFIN hat)) (VVFIN heißt))) ($. :) (NP (PN (NE Saif) (NE a-Din) (NE Mustafa))) ($. .),True
Er kommt aus dem Land Ägypten.,(S (PPER Er) (VVFIN kommt) (PP (APPR aus) (ART dem) (NN Land) (NE Ägypten))) ($. .),True
Er hat den Piloten gezwungen das Flugzeug in Zypern zu landen.,(S (PPER Er) (VAFIN hat) (VP (NP (ART den) (NN Piloten)) (VVPP gezwungen) (VP (NP (ART das) (NN Flugzeug)) (PP (APPR in) (NE Zypern)) (VZ (PTKZU zu) (VVINF landen))))) ($. .),True
Und er hat alle Menschen im Flugzeug als Geiseln genommen.,(S (KON Und) (PPER er) (VAFIN hat) (VP (NP (PIAT alle) (NN Menschen) (PP (APPRART im) (NN Flugzeug))) (PP (APPR als) (NN Geiseln)) (VVPP genommen))) ($. .),True
"Das heißt, \newline er hat sie fest-gehalten und im Flugzeug gefangen gehalten.","(S (PDS Das) (VVFIN heißt)) ($, ,) (XY \newline) (S (PPER er) (VAFIN hat) (CVP (VP (PPER sie) (VVPP fest-gehalten)) (KON und) (VP (PP (APPRART im) (NN Flugzeug)) (ADJD gefangen) (VVPP gehalten)))) ($. .)",True
Er hat 64 Menschen als Geiseln im Flugzeug gefangen gehalten.,(S (PPER Er) (VAFIN hat) (VP (NP (CARD 64) (NN Menschen)) (PP (APPR als) (NN Geiseln)) (PP (APPRART im) (NN Flugzeug)) (ADJD gefangen) (VVPP gehalten))) ($. .),True
"Der Mann hat den Menschen im Flugzeug gedroht, \newline er sprengt sich selbst mit einem Spreng-stoff-gürtel in die Luft.","(S (NP (ART Der) (NN Mann)) (VAFIN hat) (VP (NP (ART den) (NN Menschen) (PP (APPRART im) (NN Flugzeug))) (VVPP gedroht))) ($, ,) (NE \newline)",True
Nach einer Zeit hat er die Menschen im Flugzeug frei gelassen.,(S (PP (APPR Nach) (ART einer) (NN Zeit)) (VAFIN hat) (PPER er) (VP (NP (ART die) (NN Menschen) (PP (APPRART im) (NN Flugzeug))) (ADJD frei) (VVPP gelassen))) ($. .),True
Die Menschen im Flugzeug sind ausgestiegen.,(S (NP (ART Die) (NN Menschen) (PP (APPRART im) (NN Flugzeug))) (VAFIN sind) (VVPP ausgestiegen)) ($. .),True
Saif a-Din Mustafa hat aufgegeben und sich ergeben.,(S (PN (NE Saif) (NE a-Din) (NE Mustafa)) (VAFIN hat) (CVP (VVPP aufgegeben) (KON und) (VP (PRF sich) (VVPP ergeben)))) ($. .),True
Die Polizei hat ihn festgenommen.,(S (NP (ART Die) (NN Polizei)) (VAFIN hat) (VP (PPER ihn) (VVPP festgenommen))) ($. .),True
"Was Saif a-Din Mustafa erreichen will, \newline weiß man nicht genau.","(S (PWS Was) (PN (NE Saif) (NE a-Din) (NE Mustafa)) (VP (VVINF erreichen)) (VMFIN will)) ($, ,) (S (PDS \newline) (VVFIN weiß) (PIS man) (PTKNEG nicht) (ADJD genau)) ($. .)",True
"Manche Nachrichten sagen, \newline er wollte mit seiner Ex­frau sprechen und ist krank.","(S (NP (PIAT Manche) (NN Nachrichten)) (VVFIN sagen)) ($, ,) (CS (XY \newline) (CS (S (PPER er) (VMFIN wollte) (VP (PP (APPR mit) (PPOSAT seiner) (NN Ex­frau)) (VVINF sprechen))) (KON und) (S (VAFIN ist) (ADJD krank)))) ($. .)",True
Egypt-Air-Flug 181 ist ein besonderer Flug mit einem Flugzeug gewesen.,(S (PN (NE Egypt-Air-Flug) (CARD 181)) (VAFIN ist) (VP (NP (ART ein) (ADJA besonderer) (NN Flug) (PP (APPR mit) (ART einem) (NN Flugzeug))) (VAPP gewesen))) ($. .),True
Der Flug ist am 29. März 2016 in Ägypten gewesen.,(S (NP (ART Der) (NN Flug)) (VAFIN ist) (VP (PP (APPRART am) (ADJA 29.) (NN März) (CARD 2016)) (PP (APPR in) (NE Ägypten)) (VAPP gewesen))) ($. .),True
Das Flugzeug soll von der Stadt Alexandria in die Stadt Kairo fliegen.,(S (NP (ART Das) (NN Flugzeug)) (VMFIN soll) (VP (PP (APPR von) (ART der) (NN Stadt) (NE Alexandria)) (PP (APPR in) (ART die) (NN Stadt) (NE Kairo)) (VVINF fliegen))) ($. .),True
Während des Fluges ist das Flugzeug entführt worden.,(S (PP (APPR Während) (ART des) (NN Fluges)) (VAFIN ist) (NP (ART das) (NN Flugzeug)) (VP (VP (VVPP entführt)) (VAPP worden))) ($. .),True
Ein Mann hat das Flugzeug entführt.,(S (NP (ART Ein) (NN Mann)) (VAFIN hat) (VP (NP (ART das) (NN Flugzeug)) (VVPP entführt))) ($. .),True
Er hat die Menschen im Flugzeug fest-gehalten.,(S (PPER Er) (VAFIN hat) (VP (NP (ART die) (NN Menschen)) (PP (APPRART im) (NN Flugzeug)) (VVPP fest-gehalten))) ($. .),True
Und er hat den Piloten gezwungen das Flugzeug zu landen.,(S (KON Und) (PPER er) (VAFIN hat) (VP (NP (ART den) (NN Piloten)) (VVPP gezwungen) (VP (NP (ART das) (NN Flugzeug)) (VZ (PTKZU zu) (VVINF landen))))) ($. .),True
Eine Steuer ist Geld.,(S (NP (ART Eine) (NN Steuer)) (VAFIN ist) (NN Geld)) ($. .),True
Bürger in einem Land zahlen Geld an ihr Land.,(S (NP (NN Bürger) (PP (APPR in) (ART einem) (NN Land))) (VVFIN zahlen) (NN Geld) (PP (APPR an) (PPOSAT ihr) (NN Land))) ($. .),True
Mit dem Geld werden verschiedene Sachen bezahlt.,(S (PP (APPR Mit) (ART dem) (NN Geld)) (VAFIN werden) (NP (ADJA verschiedene) (NN Sachen)) (VP (VVPP bezahlt))) ($. .),True
Zum Beispiel: • Straßen,(PP (APPRART Zum) (NN Beispiel)) ($. :) (XY •) (NN Straßen),False
Zum Beispiel: • Polizisten,(PP (APPRART Zum) (NN Beispiel)) ($. :) (XY •) (NN Polizisten),False
Zum Beispiel: • Lehrer,(PP (APPRART Zum) (NN Beispiel)) ($. :) (XY •) (NN Lehrer),False
Zum Beispiel: • Schulen,(PP (APPRART Zum) (NN Beispiel)) ($. :) (XY •) (NN Schulen),False
Zum Beispiel: • Krankenhäuser,(PP (APPRART Zum) (NN Beispiel)) ($. :) (XY •) (NN Krankenhäuser),False
Zum Beispiel: • Militär und Waffen,(PP (APPRART Zum) (NN Beispiel)) ($. :) (XY •) (CNP (NN Militär) (KON und) (NN Waffen)),False
In Deutschland gibt es verschiedene Regeln für die Steuer.,(S (PP (APPR In) (NE Deutschland)) (VVFIN gibt) (PPER es) (NP (ADJA verschiedene) (NN Regeln) (PP (APPR für) (ART die) (NN Steuer)))) ($. .),True
Das heißt die Bürger zahlen unterschiedlich viele Steuern.,(S (PDS Das) (VVFIN heißt) (S (NP (ART die) (NN Bürger)) (VVFIN zahlen) (NP (AP (ADJD unterschiedlich) (PIAT viele)) (NN Steuern)))) ($. .),True
"Wer mehr Geld verdient, soll mehr Steuern zahlen.","(S (PWS Wer) (NP (PIAT mehr) (NN Geld)) (VVFIN verdient)) ($, ,) (S (VMFIN soll) (VP (NP (PIAT mehr) (NN Steuern)) (VVINF zahlen))) ($. .)",True
"Wer wenig Geld verdient, soll weniger Steuern zahlen.","(S (PWS Wer) (NP (PIAT wenig) (NN Geld)) (VVFIN verdient)) ($, ,) (S (VMFIN soll) (VP (NP (PIAT weniger) (NN Steuern)) (VVINF zahlen))) ($. .)",True
Das Ehe-gatten-splitting ist für Menschen die zusammen leben.,(S (NP (ART Das) (NN Ehe-gatten-splitting)) (VAFIN ist) (APPR für) (NN Menschen) (S (PRELS die) (ADV zusammen) (VVFIN leben))) ($. .),True
Zum Beispiel eine Frau und ein Mann die geheiratet haben.,(S (PP (PP (APPRART Zum) (NN Beispiel)) (CNP (NP (ART eine) (NN Frau)) (KON und) (NP (ART ein) (NN Mann)))) (PRELS die) (VVPP geheiratet) (VAFIN haben)) ($. .),True
Oder wer eine eingetragene Lebens-partnerschaft hat.,(S (KON Oder) (PWS wer) (NP (ART eine) (ADJA eingetragene) (NN Lebens-partnerschaft)) (VAFIN hat)) ($. .),True
"Das heißt, die Regel gilt auch für schwule und lesbische Paare.","(S (PDS Das) (VVFIN heißt)) ($, ,) (S (NP (ART die) (NN Regel)) (VVFIN gilt) (PP (ADV auch) (APPR für) (CAP (ADJA schwule) (KON und) (ADJA lesbische)) (NN Paare))) ($. .)",True
Beispiel für die Steuer-regel Ehe-gatten-splitting.,(NP (NN Beispiel) (PP (APPR für) (ART die) (NN Steuer-regel) (NN Ehe-gatten-splitting))) ($. .),False
Ein Mann und eine Frau haben geheiratet.,(S (CNP (NP (ART Ein) (NN Mann)) (KON und) (NP (ART eine) (NN Frau))) (VAFIN haben) (VVPP geheiratet)) ($. .),True
Der Mann verdient wenig Geld.,(S (NP (ART Der) (NN Mann)) (VVFIN verdient) (NP (PIAT wenig) (NN Geld))) ($. .),True
Die Frau verdient viel Geld.,(S (NP (ART Die) (NN Frau)) (VVFIN verdient) (NP (PIAT viel) (NN Geld))) ($. .),True
Beide müssen Steuern zahlen.,(S (PIS Beide) (VMFIN müssen) (VP (NN Steuern) (VVINF zahlen))) ($. .),True
Beim Ehe-gatten-splitting wird das verdiente Geld vom Mann und der Frau zusammen gezählt.,(S (PP (APPRART Beim) (NN Ehe-gatten-splitting)) (VAFIN wird) (NP (ART das) (ADJA verdiente) (NN Geld)) (VP (PP (APPRART vom) (CNP (NN Mann) (KON und) (NP (ART der) (NN Frau))) (ADV zusammen)) (VVPP gezählt))) ($. .),True
Das Ergebnis wird halbiert.,(S (NP (ART Das) (NN Ergebnis)) (VAFIN wird) (VVPP halbiert)) ($. .),True
Jetzt muß jeder für diese Hälfte Steuern zahlen.,(S (ADV Jetzt) (VMFIN muß) (PIS jeder) (VP (PP (APPR für) (PDAT diese) (NN Hälfte)) (NN Steuern) (VVINF zahlen))) ($. .),True
Diese Regel ist ungerecht.,(S (NP (PDAT Diese) (NN Regel)) (VAFIN ist) (ADJD ungerecht)) ($. .),True
