sentence,tree,is_sent
Die Polizei und Experten versuchen heraus zu finden wer der Mann ist.,(S (CNP (NP (ART Die) (NN Polizei)) (KON und) (NN Experten)) (VVFIN versuchen) (VP (VP (PTKVZ heraus) (VZ (PTKZU zu) (VVINF finden))) (PWS wer) (NP (ART der) (NN Mann)) (VAFIN ist))) ($. .),True
Und wo der Mann sich versteckt hat.,(S (KON Und) (PWAV wo) (NP (ART der) (NN Mann)) (VP (PRF sich) (VVPP versteckt)) (VAFIN hat)) ($. .),True
Die Polizei in der Türkei sagt: der Mann hat Terrorismus gemacht.,(S (NP (ART Die) (NN Polizei) (PP (APPR in) (ART der) (NE Türkei))) (VVFIN sagt)) ($. :) (S (NP (ART der) (NN Mann)) (VAFIN hat) (VP (NN Terrorismus) (VVPP gemacht))) ($. .),True
Und der Mann hat eine Lang-waffe zum schießen benutzt.,(S (KON Und) (NP (ART der) (NN Mann)) (VAFIN hat) (VP (NP (ART eine) (NN Lang-waffe)) (PP (APPRART zum) (NN schießen)) (VVPP benutzt))) ($. .),True
Die IS Gruppe hat gesagt: wir haben den Anschlag gemacht.,(S (NP (ART Die) (NE IS) (NN Gruppe)) (VAFIN hat) (VP (VVPP gesagt))) ($. :) (S (PPER wir) (VAFIN haben) (VP (NP (ART den) (NN Anschlag)) (VVPP gemacht))) ($. .),True
Und der Mann gehört zu unserer Gruppe.,(S (KON Und) (NP (ART der) (NN Mann)) (VVFIN gehört) (PP (APPR zu) (PPOSAT unserer) (NN Gruppe))) ($. .),True
Der Mann dem der Nacht-club gehört hat gesagt: der Geheim-dienst von den Vereinigte Staaten hat ihn gewarnt.,(S (NP (ART Der) (NN Mann)) (PRELS dem) (NP (ART der) (NN Nacht-club)) (VP (VVPP gehört)) (VAFIN hat) (VP (VVPP gesagt))) ($. :),True
Der Geheim-dienst hat gesagt es gibt einen Anschlag auf den Nacht-club.,(S (NP (ART Der) (NN Geheim-dienst)) (VAFIN hat) (VP (VVPP gesagt)) (S (PPER es) (VVFIN gibt) (NP (ART einen) (NN Anschlag) (PP (APPR auf) (ART den) (NN Nacht-club))))) ($. .),True
Der Geheim-dienst von Amerika sagt das stimmt nicht.,(S (NP (ART Der) (NN Geheim-dienst) (PP (APPR von) (NE Amerika))) (VVFIN sagt) (S (PDS das) (VVFIN stimmt) (PTKNEG nicht))) ($. .),True
"Angela Merkel hat gesagt, \newline dass der Anschlag böse und schrecklich gewesen ist.","(S (PN (NE Angela) (NE Merkel)) (VAFIN hat) (VP (VVPP gesagt))) ($, ,) (S (ADV \newline) (KOUS dass) (NP (ART der) (NN Anschlag)) (VP (CAP (ADJD böse) (KON und) (ADJD schrecklich)) (VAPP gewesen)) (VAFIN ist)) ($. .)",True
Sie denkt an die gestorbenen Menschen.,(S (PPER Sie) (VVFIN denkt) (PP (APPR an) (ART die) (ADJA gestorbenen) (NN Menschen))) ($. .),True
Und an die verletzten Menschen.,(S (KON Und) (PP (APPR an) (ART die) (ADJA verletzten) (NN Menschen))) ($. .),False
In der Türkei hat es schon viele Anschläge gegeben.,(S (PP (APPR In) (ART der) (NE Türkei)) (VAFIN hat) (PPER es) (VP (ADV schon) (NP (PIAT viele) (NN Anschläge)) (VVPP gegeben))) ($. .),True
Im Jahr 2016 hat es 20 Anschläge gegeben.,(S (PP (APPRART Im) (NN Jahr) (CARD 2016)) (VAFIN hat) (PPER es) (VP (NP (CARD 20) (NN Anschläge)) (VVPP gegeben))) ($. .),True
Zum Beispiel am 12. Januar 2016. \newline Oder am 17. Februar 2016 in Ankara.,(PP (APPRART Zum) (NN Beispiel)) (APPRART am) (ADJA 12.) (NN Januar) ($. 2016.),False
Oder am 10. Dezember in Istanbul.,(S (KON Oder) (PP (APPRART am) (ADJA 10.) (NN Dezember)) (PP (APPR in) (NE Istanbul))) ($. .),False
Der Anschlag in Istanbul ist am 1. Januar 2017 gewesen.,(S (NP (ART Der) (NN Anschlag) (PP (APPR in) (NE Istanbul))) (VAFIN ist) (VP (PP (APPRART am) (ADJA 1.) (NN Januar) (CARD 2017)) (VAPP gewesen))) ($. .),True
Dabei sind 37 Menschen getötet.,(S (PROAV Dabei) (VAFIN sind) (NP (CARD 37) (NN Menschen)) (VP (VVPP getötet))) ($. .),True
Und sehr viele Menschen sind verletzt.,(S (KON Und) (NP (AP (ADV sehr) (PIAT viele)) (NN Menschen)) (VAFIN sind) (VVPP verletzt)) ($. .),True
Ein Mann hat mit einer Waffe auf viele Menschen geschossen.,(S (NP (ART Ein) (NN Mann)) (VAFIN hat) (VP (PP (APPR mit) (ART einer) (NN Waffe)) (PP (APPR auf) (PIAT viele) (NN Menschen)) (VVPP geschossen))) ($. .),True
Gemacht hat das der Mann in einem Nacht-club.,(S (VP (VVPP Gemacht)) (VAFIN hat) (PDS das) (NP (ART der) (NN Mann)) (PP (APPR in) (ART einem) (NN Nacht-club))) ($. .),True
Viele Menschen haben dort gefeiert.,(S (NP (PIAT Viele) (NN Menschen)) (VAFIN haben) (VP (ADV dort) (VVPP gefeiert))) ($. .),True
Im Nacht-club haben über 700 Menschen gefeiert.,(S (PP (APPRART Im) (NN Nacht-club)) (VAFIN haben) (NP (AP (ADV über) (CARD 700)) (NN Menschen)) (VP (VVPP gefeiert))) ($. .),True
Der Anschlag ist in der Stadt Istanbul gewesen.,(S (NP (ART Der) (NN Anschlag)) (VAFIN ist) (VP (PP (APPR in) (ART der) (NN Stadt) (NE Istanbul)) (VAPP gewesen))) ($. .),True
Das ist in der Türkei.,(S (PDS Das) (VAFIN ist) (PP (APPR in) (ART der) (NE Türkei))) ($. .),True
Am 10. Dezember 2016 hat es diese 2 Anschläge gegeben.,(S (PP (APPRART Am) (ADJA 10.) (NN Dezember) (CARD 2016)) (VAFIN hat) (PPER es) (VP (NP (PDAT diese) (CARD 2) (NN Anschläge)) (VVPP gegeben))) ($. .),True
Der Anschlag in Istanbul ist am 10. Dezember 2016 gewesen.,(S (NP (ART Der) (NN Anschlag) (PP (APPR in) (NE Istanbul))) (VAFIN ist) (VP (PP (APPRART am) (ADJA 10.) (NN Dezember) (CARD 2016)) (VAPP gewesen))) ($. .),True
Dabei sind 44 Menschen getötet.,(S (PROAV Dabei) (VAFIN sind) (NP (CARD 44) (NN Menschen)) (VP (VVPP getötet))) ($. .),True
Und viele Menschen sind verletzt.,(S (KON Und) (NP (PIAT viele) (NN Menschen)) (VAFIN sind) (VVPP verletzt)) ($. .),True
Jemand hat ein Auto in die Luft gesprengt.,(S (PIS Jemand) (VAFIN hat) (VP (NP (ART ein) (NN Auto)) (PP (APPR in) (ART die) (NN Luft)) (VVPP gesprengt))) ($. .),True
Und ein Mann hat sich in die Luft gesprengt.,(S (KON Und) (NP (ART ein) (NN Mann)) (VAFIN hat) (VP (PRF sich) (PP (APPR in) (ART die) (NN Luft)) (VVPP gesprengt))) ($. .),True
Die Täter haben das absichtlich gemacht.,(S (NP (ART Die) (NN Täter)) (VAFIN haben) (VP (PDS das) (ADJD absichtlich) (VVPP gemacht))) ($. .),True
Sie haben viele Menschen töten und verletzen wollen.,(S (PPER Sie) (VAFIN haben) (VP (CVP (VP (NP (PIAT viele) (NN Menschen)) (VVINF töten)) (KON und) (VP (VVINF verletzen))) (VMINF wollen))) ($. .),True
Die Täter sind dabei selbst gestorben.,(S (NP (ART Die) (NN Täter)) (VAFIN sind) (PROAV dabei) (NP (ADV selbst)) (VP (VVPP gestorben))) ($. .),True
Der Anschlag ist in der Stadt Istanbul gewesen.,(S (NP (ART Der) (NN Anschlag)) (VAFIN ist) (VP (PP (APPR in) (ART der) (NN Stadt) (NE Istanbul)) (VAPP gewesen))) ($. .),True
"Der Mann der sich in die Luft gesprengt hat, \newline ist ein Selbst-mord-Attentäter.","(ART Der) (NN Mann) (PRELS der) (VP (PRF sich) (PP (APPR in) (ART die) (NN Luft)) (VVPP gesprengt)) (VAFIN hat) ($, ,) (S (NE \newline) (VAFIN ist) (NP (ART ein) (NN Selbst-mord-Attentäter))) ($. .)",True
Sein Name ist Nabil Fadli.,(S (NP (PPOSAT Sein) (NN Name)) (VAFIN ist) (PN (NE Nabil) (NE Fadli))) ($. .),True
Er hat sich an einem Platz mit vielen Menschen in die Luft gesprengt.,(S (PPER Er) (VAFIN hat) (VP (PRF sich) (PP (APPR an) (ART einem) (NN Platz) (PP (APPR mit) (PIAT vielen) (NN Menschen))) (PP (APPR in) (ART die) (NN Luft)) (VVPP gesprengt))) ($. .),True
"Nabil Fadli  hat sich zu den anderen Menschen gestellt und dann die Bombe gezündet, \newline Er ist dabei selbst gestorben.","(S (PN (NE Nabil) (NE Fadli)) (VAFIN  ) (CVP (VAFIN hat) (CVP (VP (PRF sich) (PP (APPR zu) (ART den) (ADJA anderen) (NN Menschen)) (VVPP gestellt)) (KON und) (VP (ADV dann) (NP (ART die) (NN Bombe)) (VVPP gezündet))))) ($, ,) (NE \newline)",True
Der Platz heißt Sultan-Ahmed-Platz und ist sehr bekannt.,(CS (S (NP (ART Der) (NN Platz)) (VVFIN heißt) (NE Sultan-Ahmed-Platz)) (KON und) (S (VAFIN ist) (AP (ADV sehr) (ADJD bekannt)))) ($. .),True
Sehr viele Touristen besuchen den Platz.,(S (NP (AP (ADV Sehr) (PIAT viele)) (NN Touristen)) (VVFIN besuchen) (NP (ART den) (NN Platz))) ($. .),True
Nabil Fadli ist 28 Jahre alt gewesen.,(S (PN (NE Nabil) (NE Fadli)) (VAFIN ist) (VP (AP (NP (CARD 28) (NN Jahre)) (ADJD alt)) (VAPP gewesen))) ($. .),True
Er gehört zur IS Gruppe.,(S (PPER Er) (VVFIN gehört) (PP (APPRART zur) (NE IS) (NN Gruppe))) ($. .),True
Nach dem Anschlag hat es eine Nachrichten-sperre gegeben.,(S (PP (APPR Nach) (ART dem) (NN Anschlag)) (VAFIN hat) (PPER es) (VP (NP (ART eine) (NN Nachrichten-sperre)) (VVPP gegeben))) ($. .),True
"Das heißt,  \newline Informationen weiter zu geben ist verboten.","(S (PDS Das) (VVFIN heißt)) ($, ,) ($.  ) (S (VP (NP (ADJA \newline) (NN Informationen)) (ADV weiter) (VZ (PTKZU zu) (VVINF geben))) (VAFIN ist) (VVPP verboten)) ($. .)",True
10 Menschen sind bei dem Anschlag getötet worden.,(S (NP (CARD 10) (NN Menschen)) (VAFIN sind) (VP (VP (PP (APPR bei) (ART dem) (NN Anschlag)) (VVPP getötet)) (VAPP worden))) ($. .),True
8 Menschen kommen aus Deutschland und eine Person kommt aus Peru.,(CS (S (NP (CARD 8) (NN Menschen)) (VVFIN kommen) (PP (APPR aus) (NE Deutschland))) (KON und) (S (NP (ART eine) (NN Person)) (VVFIN kommt) (PP (APPR aus) (NE Peru)))) ($. .),True
Der Anschlag in Istanbul ist am 12. Januar 2016 gewesen.,(S (NP (ART Der) (NN Anschlag) (PP (APPR in) (NE Istanbul))) (VAFIN ist) (VP (PP (APPRART am) (ADJA 12.) (NN Januar) (CARD 2016)) (VAPP gewesen))) ($. .),True
Dabei sind 10 Menschen getötet worden.,(S (PROAV Dabei) (VAFIN sind) (NP (CARD 10) (NN Menschen)) (VP (VP (VVPP getötet)) (VAPP worden))) ($. .),True
Und viele Menschen sind verletzt worden.,(S (KON Und) (NP (PIAT viele) (NN Menschen)) (VAFIN sind) (VP (VVPP verletzt) (VAPP worden))) ($. .),True
Ein Mann hat sich auf einem Platz mit vielen Menschen in die Luft gesprengt.,(S (NP (ART Ein) (NN Mann)) (VAFIN hat) (VP (PRF sich) (PP (APPR auf) (ART einem) (NN Platz) (PP (APPR mit) (PIAT vielen) (NN Menschen))) (PP (APPR in) (ART die) (NN Luft)) (VVPP gesprengt))) ($. .),True
Das hat der Täter absichtlich gemacht.,(S (PDS Das) (VAFIN hat) (NP (ART der) (NN Täter)) (VP (ADJD absichtlich) (VVPP gemacht))) ($. .),True
Der Täter ist dabei selbst gestorben.,(S (NP (ART Der) (NN Täter)) (VAFIN ist) (PROAV dabei) (NP (ADV selbst)) (VP (VVPP gestorben))) ($. .),True
Der Anschlag ist in der Stadt Istanbul gewesen.,(S (NP (ART Der) (NN Anschlag)) (VAFIN ist) (VP (PP (APPR in) (ART der) (NN Stadt) (NE Istanbul)) (VAPP gewesen))) ($. .),True
Das ist in der Türkei.,(S (PDS Das) (VAFIN ist) (PP (APPR in) (ART der) (NE Türkei))) ($. .),True
Bei dem Attentat wurden 12 Menschen getötet.,(S (PP (APPR Bei) (ART dem) (NN Attentat)) (VAFIN wurden) (NP (CARD 12) (NN Menschen)) (VP (VVPP getötet))) ($. .),True
Und 11 Menschen wurden verletzt.,(S (KON Und) (NP (CARD 11) (NN Menschen)) (VAFIN wurden) (VVPP verletzt)) ($. .),True
Es war ein Terror Anschlag.,(S (PPER Es) (VAFIN war) (NP (ART ein) (NN Terror) (NN Anschlag))) ($. .),True
Der Anschlag auf Charlie Hebdo ist am 7. Januar 2015 passiert.,(S (NP (ART Der) (NN Anschlag) (PP (APPR auf) (PN (NE Charlie) (NE Hebdo)))) (VAFIN ist) (VP (PP (APPRART am) (ADJA 7.) (NN Januar) (CARD 2015)) (VVPP passiert))) ($. .),True
2 Männer haben mit Waffen auf andere Menschen geschossen.,(S (NP (CARD 2) (NN Männer)) (VAFIN haben) (VP (PP (APPR mit) (NN Waffen)) (PP (APPR auf) (ADJA andere) (NN Menschen)) (VVPP geschossen))) ($. .),True
Das ist in Paris in den Räumen von Charlie Hebdo passiert.,(S (PDS Das) (VAFIN ist) (VP (PP (APPR in) (NE Paris)) (PP (APPR in) (ART den) (NN Räumen) (PP (APPR von) (PN (NE Charlie) (NE Hebdo)))) (VVPP passiert))) ($. .),True
Fußball-spieler von Borussia Dortmund sind mit dem Bus gefahren.,(S (NP (NN Fußball-spieler) (PP (APPR von) (PN (NP (NE Borussia) (NE Dortmund))))) (VAFIN sind) (VP (PP (APPR mit) (ART dem) (NN Bus)) (VVPP gefahren))) ($. .),True
Sie sind zu einem UEFA Spiel gefahren.,(S (PPER Sie) (VAFIN sind) (VP (PP (APPR zu) (ART einem) (NE UEFA) (NN Spiel)) (VVPP gefahren))) ($. .),True
Zum UEFA-spiel Borussia Dortmund gegen AS Monaco.,(PP (APPRART Zum) (NN UEFA-spiel)),False
Ein Mann hat auf der Straße 3 Spreng-bomben versteckt.,(S (NP (ART Ein) (NN Mann)) (VAFIN hat) (VP (PP (APPR auf) (ART der) (NN Straße)) (NP (CARD 3) (NN Spreng-bomben)) (VVPP versteckt))) ($. .),True
"Als der Bus mit den Fußball-spieler vorbei-gefahren ist, \newline sind die Spreng-bomben explodiert.","(KOUS Als) (NP (ART der) (NN Bus) (PP (APPR mit) (ART den) (NN Fußball-spieler))) (VVPP vorbei-gefahren) (VAFIN ist) ($, ,) (S (ADV \newline) (VAFIN sind) (NP (ART die) (NN Spreng-bomben)) (VP (VVPP explodiert))) ($. .)",True
Bei dem Anschlag ist ein Fußball-spieler und ein Polizist verletzt worden.,(S (PP (APPR Bei) (ART dem) (NN Anschlag)) (VAFIN ist) (CNP (NP (ART ein) (NN Fußball-spieler)) (KON und) (NP (ART ein) (NN Polizist))) (VP (VP (VVPP verletzt)) (VAPP worden))) ($. .),True
Das Fußball-spiel ist wegen dem Anschlag abgesagt worden.,(S (NP (ART Das) (NN Fußball-spiel)) (VAFIN ist) (VP (VP (PP (APPR wegen) (ART dem) (NN Anschlag)) (VVPP abgesagt)) (VAPP worden))) ($. .),True
"Manche sagen, \newline die IS Gruppe hat den Anschlag gemacht.","(S (PIS Manche) (VVFIN sagen)) ($, ,) (S (NP (FM \newline) (ART die) (NE IS) (NN Gruppe)) (VAFIN hat) (VP (NP (ART den) (NN Anschlag)) (VVPP gemacht))) ($. .)",True
"Die Polizei sagt,  \newline das ist falsch.","(S (NP (ART Die) (NN Polizei)) (VVFIN sagt)) ($, ,) ($.  ) (S (XY \newline) (S (PDS das) (VAFIN ist) (ADJD falsch))) ($. .)",True
Die Polizei hat 3 Bekenner-schreiben gefunden.,(S (NP (ART Die) (NN Polizei)) (VAFIN hat) (VP (NP (CARD 3) (NN Bekenner-schreiben)) (VVPP gefunden))) ($. .),True
Und sie hat einen Mann fest-genommen.,(S (KON Und) (PPER sie) (VAFIN hat) (VP (NP (ART einen) (NN Mann)) (VVPP fest-genommen))) ($. .),True
Der Mann heißt Sergej W.  \newline Er ist 28 Jahre alt.,(S (NP (ART Der) (NN Mann)) (VVFIN heißt) (PN (NE Sergej) (NE W.))) ($.  ),True
Er hat die Bomben gemacht.,(S (PPER Er) (VAFIN hat) (VP (NP (ART die) (NN Bomben)) (VVPP gemacht))) ($. .),True
Sergej W. hat den Anschlag aus Habgier gemacht.,(S (PN (NE Sergej) (NE W.)) (VAFIN hat) (VP (VP (NP (ART den) (NN Anschlag)) (PP (APPR aus) (NE Habgier)) (VVPP  )) (VVPP gemacht))) ($. .),True
Er wollte das die Aktien vom Fußball-verein Borussia Dortmund weniger Wert sind.,(S (PPER Er) (VMFIN wollte) (PDS das)),True
Er wollte damit viel Geld verdienen.,(S (PPER Er) (VMFIN wollte) (VP (PROAV damit) (NP (PIAT viel) (NN Geld)) (VVINF verdienen))) ($. .),True
Darum hat er vor dem Anschlag Options-schein gekauft.,(S (PROAV Darum) (VAFIN hat) (PPER er) (VP (PP (APPR vor) (ART dem) (NN Anschlag)) (NN Options-schein) (VVPP gekauft))) ($. .),True
Der Anschlag auf den Bus von Borussia Dortmund ist am 11. April 2017 passiert.,(S (NP (ART Der) (NN Anschlag) (PP (APPR auf) (ART den) (NN Bus) (PP (APPR von) (PN (NE Borussia) (NE Dortmund))))) (VAFIN ist) (VP (PP (APPRART am) (ADJA 11.) (NN April) (CARD 2017)) (VVPP passiert))) ($. .),True
Jemand hat auf er Straße Spreng-stoff versteckt.,(S (PIS Jemand) (VAFIN hat) (VP (PP (APPR auf) (PPOSAT er) (NN Straße)) (NN Spreng-stoff) (VVPP versteckt))) ($. .),True
"Als der Bus von Borussia Dortmund vorbei-gefahren ist, \newline ist der Spreng-stoff explodiert.","(KOUS Als) (NP (ART der) (NN Bus)) (VP (PP (APPR von) (PN (NE Borussia) (NE Dortmund))) (VVPP vorbei-gefahren)) (VAFIN ist) ($, ,) (S (ADV \newline) (VAFIN ist) (NP (ART der) (NN Spreng-stoff)) (VP (VVPP explodiert))) ($. .)",True
Ein Polizist und ein Fußball-spieler sind verletzt.,(S (CNP (NP (ART Ein) (NN Polizist)) (KON und) (NP (ART ein) (NN Fußball-spieler))) (VAFIN sind) (VVPP verletzt)) ($. .),True
Der Anschlag ist in Höchsten passiert.,(S (NP (ART Der) (NN Anschlag)) (VAFIN ist) (VP (PP (APPR in) (NN Höchsten)) (VVPP passiert))) ($. .),True
In Ankara gab es eine Demonstration.,(S (PP (APPR In) (NE Ankara)) (VVFIN gab) (PPER es) (NP (ART eine) (NN Demonstration))) ($. .),True
Die Menschen auf der Demonstration wollen das der Türkei-PKK-Konflikt aufhört.,(S (NP (ART Die) (NN Menschen) (PP (APPR auf) (ART der) (NN Demonstration))) (VMFIN wollen) (S (KOUS das) (NP (ART der) (NN Türkei-PKK-Konflikt)) (VVFIN aufhört))) ($. .),True
Es sind viele Menschen zur Demonstration gekommen.,(S (PPER Es) (VAFIN sind) (NP (PIAT viele) (NN Menschen)) (VP (PP (APPRART zur) (NN Demonstration)) (VVPP gekommen))) ($. .),True
Es gab eine große Menschen-menge.,(S (PPER Es) (VVFIN gab) (NP (ART eine) (ADJA große) (NN Menschen-menge))) ($. .),True
Dann hat jemand in der Menschen-menge eine Bombe gezündet.,(S (ADV Dann) (VAFIN hat) (NP (PIS jemand) (PP (APPR in) (ART der) (NN Menschen-menge))) (VP (NP (ART eine) (NN Bombe)) (VVPP gezündet))) ($. .),True
"Wer den Anschlag gemacht hat, \newline weiß man noch nicht.","(S (PWS Wer) (VP (NP (ART den) (NN Anschlag)) (VVPP gemacht)) (VAFIN hat)) ($, ,) (S (PDS \newline) (VVFIN weiß) (PIS man) (AVP (ADV noch) (PTKNEG nicht))) ($. .)",True
Manche sagen es war die IS Gruppe.,(S (PIS Manche) (VVFIN sagen) (S (PPER es) (VAFIN war) (NP (ART die) (NE IS) (NN Gruppe)))) ($. .),True
Manche sagen die Bomben waren ähnlich wie beim Anschlag in Suruc.,(S (PIS Manche) (VVFIN sagen) (S (NP (ART die) (NN Bomben)) (VAFIN waren) (AP (ADJD ähnlich) (PP (KOKOM wie) (APPRART beim) (NN Anschlag) (PP (APPR in) (NE Suruc)))))) ($. .),True
Die Menschen auf der Demo wollen das der Türkei-PKK-Konflikt aufhört.,(S (NP (ART Die) (NN Menschen) (PP (APPR auf) (ART der) (NN Demo))) (VMFIN wollen) (S (KOUS das) (NP (ART der) (NN Türkei-PKK-Konflikt)) (VVFIN aufhört))) ($. .),True
Der Anschlag in Ankara 2015 war am 10. Oktober 2015.  \newline Dabei sind 97 Menschen gestorben.,(NP (ART Der) (NN Anschlag) (PP (APPR in) (NE Ankara)) (CARD 2015)) (VAFIN war) (APPRART am) (ADJA 10.) (NN Oktober) ($. 2015.) ($.  ) (XY \newline),False
Und sehr viele Menschen sind verletzt worden.,(S (KON Und) (NP (AP (ADV sehr) (PIAT viele)) (NN Menschen)) (VAFIN sind) (VP (VVPP verletzt) (VAPP worden))) ($. .),True
Jemand hat 2 Bomben gezündet.,(S (PIS Jemand) (VAFIN hat) (VP (NP (CARD 2) (NN Bomben)) (VVPP gezündet))) ($. .),True
Das haben die Täter absichtlich gemacht.,(S (PDS Das) (VAFIN haben) (NP (ART die) (NN Täter)) (VP (ADJD absichtlich) (VVPP gemacht))) ($. .),True
Die Täter sind dabei selbst gestorben.,(S (NP (ART Die) (NN Täter)) (VAFIN sind) (PROAV dabei) (NP (ADV selbst)) (VP (VVPP gestorben))) ($. .),True
Der Anschlag war in der Stadt Ankara.,(S (NP (ART Der) (NN Anschlag)) (VAFIN war) (PP (APPR in) (ART der) (NN Stadt) (NE Ankara))) ($. .),True
Das ist in der Türkei.,(S (PDS Das) (VAFIN ist) (PP (APPR in) (ART der) (NE Türkei))) ($. .),True
Die Täter haben Bomben in ihrem Auto versteckt.,(S (NP (ART Die) (NN Täter)) (VAFIN haben) (VP (NN Bomben) (PP (APPR in) (PPOSAT ihrem) (NN Auto)) (VVPP versteckt))) ($. .),True
Dann sind sie mit dem Auto los-gefahren.,(S (ADV Dann) (VAFIN sind) (PPER sie) (PP (APPR mit) (ART dem) (NN Auto)) (VVPP los-gefahren)) ($. .),True
"Als sie an vielen Fahrzeugen vorbei-gefahren sind, \newline haben sie die Bombe gezündet.","(S (KOUS Als) (PPER sie) (VP (PP (APPR an) (PIAT vielen) (NN Fahrzeugen)) (VVPP vorbei-gefahren)) (VAFIN sind)) ($, ,) (S (ADV \newline) (VAFIN haben) (PPER sie) (VP (NP (ART die) (NN Bombe)) (VVPP gezündet))) ($. .)",True
In den anderen Fahrzeugen sind Soldaten gewesen.,(S (PP (APPR In) (ART den) (ADJA anderen) (NN Fahrzeugen)) (VAFIN sind) (NN Soldaten) (VP (VAPP gewesen))) ($. .),True
Es hat eine Explosion und viel Feuer gegeben.,(S (PPER Es) (VAFIN hat) (VP (CNP (NP (ART eine) (NN Explosion)) (KON und) (NP (PIAT viel) (NN Feuer))) (VVPP gegeben))) ($. .),True
"Wer den Anschlag gemacht hat, \newline weiß man noch nicht.","(S (PWS Wer) (VP (NP (ART den) (NN Anschlag)) (VVPP gemacht)) (VAFIN hat)) ($, ,) (S (PDS \newline) (VVFIN weiß) (PIS man) (AVP (ADV noch) (PTKNEG nicht))) ($. .)",True
Manche sagen es ist die IS Gruppe gewesen.,(S (PIS Manche) (VVFIN sagen) (S (PPER es) (VAFIN ist) (VP (NP (ART die) (NE IS)) (NN Gruppe) (VAPP gewesen)))) ($. .),True
Weil die Türkei im Krieg in Syrien mitmacht.,(S (KOUS Weil) (NP (ART die) (NE Türkei)) (PP (APPRART im) (NN Krieg) (PP (APPR in) (NE Syrien))) (VVFIN mitmacht)) ($. .),True
Manche sagen es ist die PKK Gruppe gewesen.,(S (PIS Manche) (VVFIN sagen) (S (PPER es) (VAFIN ist) (VP (NP (ART die) (NE PKK)) (NN Gruppe) (VAPP gewesen)))) ($. .),True
Weil die Türkei Streit mit der PKK hat.,(S (KOUS Weil) (NP (ART die) (NE Türkei)) (NP (NN Streit) (PP (APPR mit) (ART der) (NE PKK))) (VAFIN hat)) ($. .),True
"Angela Merkel hat gesagt, \newline dass der Anschlag böse und schrecklich gewesen ist.","(S (PN (NE Angela) (NE Merkel)) (VAFIN hat) (VP (VVPP gesagt))) ($, ,) (S (ADV \newline) (KOUS dass) (NP (ART der) (NN Anschlag)) (VP (CAP (ADJD böse) (KON und) (ADJD schrecklich)) (VAPP gewesen)) (VAFIN ist)) ($. .)",True
Sie denkt an die gestorbenen Menschen.,(S (PPER Sie) (VVFIN denkt) (PP (APPR an) (ART die) (ADJA gestorbenen) (NN Menschen))) ($. .),True
Und an die verletzten Menschen.,(S (KON Und) (PP (APPR an) (ART die) (ADJA verletzten) (NN Menschen))) ($. .),False
"Angela Merkel hat auch gesagt, \newline die Menschen die das gemacht haben müssen bestraft werden.","(S (PN (NE Angela) (NE Merkel)) (VAFIN hat) (VP (ADV auch) (VVPP gesagt))) ($, ,) (S (ADV \newline) (ART die) (NN Menschen) (S (S (PRELS die) (VP (VP (PDS das) (VVPP gemacht)) (VAFIN haben))) (VMFIN müssen) (VP (VVPP bestraft) (VAINF werden)))) ($. .)",True
Deutschland hilft der Türkei diese Menschen zu finden und zu bestrafen.,(S (NE Deutschland) (VVFIN hilft) (NP (ART der) (NE Türkei)) (CVP (VP (NP (PDAT diese) (NN Menschen)) (VZ (PTKZU zu) (VVINF finden))) (KON und) (VZ (PTKZU zu) (VVINF bestrafen)))) ($. .),True
In der Türkei hat es schon viele Anschläge gegeben.,(S (PP (APPR In) (ART der) (NE Türkei)) (VAFIN hat) (PPER es) (VP (ADV schon) (NP (PIAT viele) (NN Anschläge)) (VVPP gegeben))) ($. .),True
Der letzte ist am 12. Januar 2016 gewesen.,(S (NP (ART Der) (ADJA letzte)) (VAFIN ist) (VP (PP (APPRART am) (ADJA 12.) (NN Januar) (CARD 2016)) (VAPP gewesen))) ($. .),True
Der Anschlag in Ankara 2016 ist am 17. Februar 2016 gewesen.,(S (NP (ART Der) (NN Anschlag) (PP (APPR in) (NE Ankara)) (CARD 2016)) (VAFIN ist) (VP (PP (APPRART am) (ADJA 17.) (NN Februar) (CARD 2016)) (VAPP gewesen))) ($. .),True
Dabei sind 26 Menschen gestorben.,(S (PROAV Dabei) (VAFIN sind) (NP (CARD 26) (NN Menschen)) (VP (VVPP gestorben))) ($. .),True
Und viele Menschen sind verletzt worden.,(S (KON Und) (NP (PIAT viele) (NN Menschen)) (VAFIN sind) (VP (VVPP verletzt) (VAPP worden))) ($. .),True
Jemand hat ein Auto in die Luft gesprengt.,(S (PIS Jemand) (VAFIN hat) (VP (NP (ART ein) (NN Auto)) (PP (APPR in) (ART die) (NN Luft)) (VVPP gesprengt))) ($. .),True
Das haben die Täter absichtlich gemacht.,(S (PDS Das) (VAFIN haben) (NP (ART die) (NN Täter)) (VP (ADJD absichtlich) (VVPP gemacht))) ($. .),True
Sie haben viele Menschen töten und verletzen wollen.,(S (PPER Sie) (VAFIN haben) (VP (CVP (VP (NP (PIAT viele) (NN Menschen)) (VVINF töten)) (KON und) (VP (VVINF verletzen))) (VMINF wollen))) ($. .),True
Die Täter sind dabei selbst gestorben.,(S (NP (ART Die) (NN Täter)) (VAFIN sind) (PROAV dabei) (NP (ADV selbst)) (VP (VVPP gestorben))) ($. .),True
Der Anschlag ist in der Stadt Ankara gewesen.,(S (NP (ART Der) (NN Anschlag)) (VAFIN ist) (VP (PP (APPR in) (ART der) (NN Stadt) (NE Ankara)) (VAPP gewesen))) ($. .),True
Das ist in der Türkei.,(S (PDS Das) (VAFIN ist) (PP (APPR in) (ART der) (NE Türkei))) ($. .),True
Die Bombe explodierte um 18:56 Uhr.,(S (NP (ART Die) (NN Bombe)) (VVFIN explodierte) (PP (APPR um) (CARD 18:56) (NN Uhr))) ($. .),True
"Wer die Bombe gezündet hat, \newline weiß man nicht.","(S (PWS Wer) (VP (NP (ART die) (NN Bombe)) (VVPP gezündet)) (VAFIN hat)) ($, ,) (S (PDS \newline) (VVFIN weiß) (PIS man) (PTKNEG nicht)) ($. .)",True
Bis jetzt hat sich niemand dazu bekannt.,(S (PP (APPR Bis) (ADV jetzt)) (VAFIN hat) (PRF sich) (PIS niemand) (VP (PROAV dazu) (VVPP bekannt))) ($. .),True
Viele glauben das es wegen politischer Meinungen gemacht worden ist.,(S (PIS Viele) (VVFIN glauben) (S (KOUS das) (PPER es) (VP (VP (PP (APPR wegen) (ADJA politischer) (NN Meinungen)) (VVPP gemacht)) (VAPP worden)) (VAFIN ist))) ($. .),True
Und weil anderen Menschen Angst gemacht werden soll.,(S (KON Und) (S (KOUS weil) (NP (ADJA anderen) (NN Menschen)) (NN Angst) (VP (VP (VVPP gemacht)) (VAINF werden)) (VMFIN soll))) ($. .),True
Damit sie nicht mehr in Thailand Urlaub machen.,(S (KOUS Damit) (PPER sie) (AVP (PTKNEG nicht) (ADV mehr)) (PP (APPR in) (NE Thailand)) (NN Urlaub) (VVFIN machen)) ($. .),True
Die Bombe explodierte zwischen vielen Menschen.,(S (NP (ART Die) (NN Bombe)) (VVFIN explodierte) (PP (APPR zwischen) (PIAT vielen) (NN Menschen))) ($. .),True
Es waren sehr viele Urlauber an dem Ort.,(S (PPER Es) (VAFIN waren) (NP (AP (ADV sehr) (PIAT viele)) (NN Urlauber)) (PP (APPR an) (ART dem) (NN Ort))) ($. .),True
Sie waren gerade im Ratchaprasong-viertel einkaufen.,(S (PPER Sie) (VAFIN waren) (VP (ADV gerade) (PP (APPRART im) (NN Ratchaprasong-viertel)) (VVINF einkaufen))) ($. .),True
Oder haben den Erawan-Schrein besucht.,(S (KON Oder) (VAFIN haben) (VP (NP (ART den) (NN Erawan-Schrein)) (VVPP besucht))) ($. .),True
In Thailand gab es schon viele Anschläge.,(S (PP (APPR In) (NE Thailand)) (VVFIN gab) (PPER es) (ADV schon) (NP (PIAT viele) (NN Anschläge))) ($. .),True
Zum Beispiel nach den Unruhen in Bangkok im Jahr 2010.  \newline  \newline Bei dem Bomben-anschlag sind viele Menschen gestorben.,(PP (APPRART Zum) (NN Beispiel)) (APPR nach) (ART den) (NN Unruhen) (PP (APPR in) (NE Bangkok)) (PP (APPRART im) (NN Jahr) ($. 2010.)),False
Wie viele genau weiß man nicht.,(S (NP (NP (PWAV Wie) (PIS viele)) (ADJD genau)) (VVFIN weiß) (PIS man) (PTKNEG nicht)) ($. .),True
Die Polizei in Bangkok untersucht den Anschlag noch.,(S (NP (ART Die) (NN Polizei) (PP (APPR in) (NE Bangkok))) (VVFIN untersucht) (NP (ART den) (NN Anschlag)) (ADV noch)) ($. .),True
