sentence,tree,is_sent,big_np_count,big_pp_count
"Ein Korsett zieht man an,  \newline weil es schön aussieht.","(S (NP (ART Ein) (NN Korsett)) (VVFIN zieht) (PIS man) (PTKVZ an)) ($, ,) ($.  ) (S (ADV \newline) (KOUS weil) (PPER es) (ADJD schön) (VVFIN aussieht)) ($. .)",1,0,0
Oder weil es für die Gesundheit gut ist.,(KON Oder) (S (KOUS weil) (PPER es) (AP (PP (APPR für) (ART die) (NN Gesundheit)) (ADJD gut)) (VAFIN ist)) ($. .),1,0,0
Zum Beispiel: \newline wenn man einen krummen Rücken hat.,(PP (APPRART Zum) (NN Beispiel)) ($. :) (S (FM \newline) (KOUS wenn) (PIS man) (NP (ART einen) (ADJA krummen) (NN Rücken)) (VAFIN hat)) ($. .),1,1,0
Ein Korsett ist ein Kleidungsstück.,(S (NP (ART Ein) (NN Korsett)) (VAFIN ist) (NP (ART ein) (NN Kleidungsstück))) ($. .),1,0,0
"Ein Korsett ist sehr eng, \newline und gibt dem Körper eine andere Form.","(CS (S (NP (ART Ein) (NN Korsett)) (VAFIN ist) (CAP (AP (ADV sehr) (ADJD eng))))) ($, ,) (ADV \newline) (KON und) (S (VVFIN gibt) (NP (ART dem) (NN Körper)) (NP (ART eine) (ADJA andere) (NN Form))) ($. .)",1,1,0
Das Wort Koryphäe ist ein Substantiv.,(S (NP (ART Das) (NN Wort) (NN Koryphäe)) (VAFIN ist) (NP (ART ein) (NN Substantiv))) ($. .),1,1,0
Bill Gates kennt sich besonders gut mit Computer aus.,(S (PN (NE Bill) (NE Gates)) (VVFIN kennt) (PRF sich) (AP (ADV besonders) (ADJD gut)) (PP (APPR mit) (NN Computer)) (PTKVZ aus)) ($. .),1,0,0
Darum ist er eine Koryphäe im Bereich Computer.,(S (PROAV Darum) (VAFIN ist) (PPER er) (NP (ART eine) (NN Koryphäe) (PP (APPRART im) (NN Bereich) (NN Computer)))) ($. .),1,1,0
"Eine Koryphäe ist eine Person, die sich besonders gut in etwas auskennt.","(S (NP (ART Eine) (NN Koryphäe)) (VAFIN ist) (ART eine) (NN Person)) ($, ,) (NP (S (PRELS die) (PRF sich) (AP (ADV besonders) (ADJD gut)) (PP (APPR in) (PIS etwas)) (VVFIN auskennt))) ($. .)",1,1,0
"Es ist ein anderes Wort für ""Experte"".","(S (PPER Es) (VAFIN ist) (ART ein) (ADJA anderes) (NN Wort) (APPR für)) ($LRB "") (NP (PP (NN Experte))) ($LRB "") ($. .)",1,0,0
Beim Kosewort kommen Buchstaben zu einem Namen dazu.,(S (PP (APPRART Beim) (NN Kosewort)) (VVFIN kommen) (NN Buchstaben) (PP (APPR zu) (ART einem) (NN Namen)) (PTKVZ dazu)) ($. .),1,0,0
Beispiel: \newline lein  \newline Maria = Marialein,(S (NN Beispiel)) ($. :) (FM \newline) (FM lein) (FM  ) (FM \newline) (NE Maria) (XY =) (NE Marialein),0,0,0
Ein Kosewort ist ein Kurz-wort für einen Namen.,(S (NP (ART Ein) (NN Kosewort)) (VAFIN ist) (NP (ART ein) (NN Kurz-wort) (PP (APPR für) (ART einen) (NN Namen)))) ($. .),1,1,0
Kosmo-politis-mus ist eine Welt-anschauung.,(S (NN Kosmo-politis-mus) (VAFIN ist) (NP (ART eine) (NN Welt-anschauung))) ($. .),1,0,0
"Das heißt, \newline wie man die Welt sieht.","(S (PDS Das) (VVFIN heißt)) ($, ,) (ADV \newline) (S (PWAV wie) (PIS man) (NP (ART die) (NN Welt)) (VVFIN sieht)) ($. .)",1,0,0
Oder wie man die Welt gerne hat.,(S (KON Oder) (PWAV wie) (PIS man) (NP (ART die) (NN Welt)) (ADV gerne) (VAFIN hat)) ($. .),1,0,0
Oder wie die Welt sein soll.,(S (KON Oder) (PWAV wie) (NP (ART die) (NN Welt)) (VP (VAINF sein)) (VMFIN soll)) ($. .),1,0,0
Wer an Kosmo-politis-mus glaubt ist Kosmo-politisch .,(S (S (PWS Wer) (PP (APPR an) (NN Kosmo-politis-mus)) (VVFIN glaubt)) (VAFIN ist) (ADJD Kosmo-politisch)) ($. .),1,0,0
Eine Frau ist ein Kosmo-politin.,(S (NP (ART Eine) (NN Frau)) (VAFIN ist) (NP (ART ein) (NN Kosmo-politin))) ($. .),1,0,0
Oder eine Welt-bürgerin.,(CNP (KON Oder) (NP (ART eine) (NN Welt-bürgerin))) ($. .),0,0,0
Ein Mann ist ein Kosmo-polit.,(S (NP (ART Ein) (NN Mann)) (VAFIN ist) (NP (ART ein) (NN Kosmo-polit))) ($. .),1,0,0
Oder ein Welt-bürger.,(CNP (KON Oder) (NP (ART ein) (NN Welt-bürger))) ($. .),0,0,0
Wenn sich mehrere Menschen als Welt-bürger zusammen-schließen sind sie eine Welt-bürger-bewegung.,(S (KOUS Wenn) (PRF sich) (NP (PIAT mehrere) (NN Menschen)) (PP (APPR als) (NN Welt-bürger)) (VVFIN zusammen-schließen) (VAFIN sind) (PPER sie) (NP (ART eine) (NN Welt-bürger-bewegung))) ($. .),1,0,0
Das Gegenteil von Kosmo-politis-mus ist Nationalis-mus.,(S (NP (ART Das) (NN Gegenteil) (PP (APPR von) (NN Kosmo-politis-mus))) (VAFIN ist) (NN Nationalis-mus)) ($. .),1,1,0
Kosmopolitismus  ist wenn man die ganze Welt als Heimat hat.,(S (NN Kosmopolitismus) (VAFIN  ) (VAFIN ist) (S (KOUS wenn) (PIS man) (NP (ART die) (ADJA ganze) (NN Welt)) (PP (APPR als) (NN Heimat)) (VAFIN hat))) ($. .),1,1,0
In jedem Teil von der Welt leben gleiche Menschen.,(S (PP (APPR In) (PIAT jedem) (NN Teil) (PP (APPR von) (ART der) (NN Welt))) (VVFIN leben) (NP (ADJA gleiche) (NN Menschen))) ($. .),1,0,1
Und man fühlt sich überall zu Hause.,(S (KON Und) (PIS man) (VVFIN fühlt) (PRF sich) (ADV überall) (PP (APPR zu) (NN Hause))) ($. .),1,0,0
Ein Kraftknoten ist ein Hilfsmittel.,(S (NP (ART Ein) (NN Kraftknoten)) (VAFIN ist) (NP (ART ein) (NN Hilfsmittel))) ($. .),1,0,0
"Das heißt, die Krankenversicherung muss den Kraftknoten bezahlen.","(S (PDS Das) (VVFIN heißt)) ($, ,) (S (NP (ART die) (NN Krankenversicherung)) (VMFIN muss) (VP (NP (ART den) (NN Kraftknoten)) (VVINF bezahlen))) ($. .)",1,0,0
An manchen Rollstühlen sind Kraftknoten.,(S (PP (APPR An) (PIAT manchen) (NN Rollstühlen)) (VAFIN sind) (NN Kraftknoten)) ($. .),1,0,0
Mit einem Kraftknoten kann man einen Rollstuhl im Auto befestigen.,(S (PP (APPR Mit) (ART einem) (NN Kraftknoten)) (VMFIN kann) (PIS man) (VP (NP (ART einen) (NN Rollstuhl)) (PP (APPRART im) (NN Auto)) (VVINF befestigen))) ($. .),1,0,0
Kraft-training macht man zum Beispiel beim Body-building.,(S (NN Kraft-training) (VVFIN macht) (PIS man) (PP (PP (APPRART zum) (NN Beispiel)) (APPRART beim) (NN Body-building))) ($. .),1,0,1
Oder beim Kraft-sport.,(S (KON Oder) (PP (APPRART beim) (NN Kraft-sport))) ($. .),0,0,0
Man kann Kraft-training mit Geräten machen.,(S (PIS Man) (VMFIN kann) (VP (NN Kraft-training) (PP (APPR mit) (NN Geräten)) (VVINF machen))) ($. .),1,0,0
Zum Beispiel mit Hanteln.,(PP (PP (APPRART Zum) (NN Beispiel)) (APPR mit) (NN Hanteln)) ($. .),0,0,1
Oder man kann sein eigenes Körper-gewicht benutzen.,(S (KON Oder) (PIS man) (VMFIN kann) (VP (NP (PPOSAT sein) (ADJA eigenes) (NN Körper-gewicht)) (VVINF benutzen))) ($. .),1,1,0
Bei den Übungen macht man Wieder-holungen.,(S (PP (APPR Bei) (ART den) (NN Übungen)) (VVFIN macht) (PIS man) (NN Wieder-holungen)) ($. .),1,0,0
Man macht die gleiche Bewegung hinter-einander.,(S (PIS Man) (VVFIN macht) (NP (ART die) (ADJA gleiche) (NN Bewegung)) (ADV hinter-einander)) ($. .),1,1,0
Ohne Pause da-zwischen.,(PP (APPR Ohne) (NN Pause)) (PROAV da-zwischen) ($. .),0,0,0
Man macht bei den Übungen Sätze.,(S (PIS Man) (VVFIN macht) (PP (APPR bei) (ART den) (NN Übungen)) (NN Sätze)) ($. .),1,0,0
Das sind Wieder-holungen und eine Pause.,(S (PDS Das) (VAFIN sind) (CNP (NN Wieder-holungen) (KON und) (NP (ART eine) (NN Pause)))) ($. .),1,0,0
Zum Beispiel 2 Sätze.,(NP (PP (APPRART Zum) (NN Beispiel)) (CARD 2) (NN Sätze)) ($. .),0,1,0
10 mal die gleiche Bewegung.,(S (AVP (CARD 10) (ADV mal)) (NP (ART die) (ADJA gleiche) (NN Bewegung))) ($. .),0,1,0
Dann eine Pause.,(S (ADV Dann) (NP (ART eine) (NN Pause))) ($. .),0,0,0
Dann wieder 10 mal die gleiche Bewegung.,(S (ADV Dann) (ADV wieder) (NP (CARD 10) (ADV mal)) (NP (ART die) (ADJA gleiche) (NN Bewegung))) ($. .),0,1,0
Und dann eine Pause.,(S (KON Und) (ADV dann) (NP (ART eine) (NN Pause))) ($. .),0,0,0
Beim Kraft-training macht man die Bewegungen langsam.,(S (PP (APPRART Beim) (NN Kraft-training)) (VVFIN macht) (PIS man) (NP (ART die) (NN Bewegungen)) (ADJD langsam)) ($. .),1,0,0
Damit man die Bewegung richtig macht.,(S (KOUS Damit) (PIS man) (NP (ART die) (NN Bewegung)) (ADJD richtig) (VVFIN macht)) ($. .),1,0,0
Schnelle und falsche Bewegungen können Sport-verletzungen geben.,(S (NP (CAP (ADJA Schnelle) (KON und) (ADJA falsche)) (NN Bewegungen)) (VMFIN können) (VP (NN Sport-verletzungen) (VVINF geben))) ($. .),1,1,0
Vor dem Kraft-training wärmt man die Muskeln auf.,(S (PP (APPR Vor) (ART dem) (NN Kraft-training)) (VVFIN wärmt) (PIS man) (NP (ART die) (NN Muskeln)) (PTKVZ auf)) ($. .),1,0,0
Damit man sich weniger verletzt.,(S (KOUS Damit) (PIS man) (PRF sich) (ADV weniger) (VVFIN verletzt)) ($. .),1,0,0
Beim Kraft-training macht man Bewegungen mit dem Körper.,(S (PP (APPRART Beim) (NN Kraft-training)) (VVFIN macht) (PIS man) (NP (NN Bewegungen) (PP (APPR mit) (ART dem) (NN Körper)))) ($. .),1,1,0
Man kann damit stärker werden.,(S (PIS Man) (VMFIN kann) (PROAV damit) (VP (ADJD stärker) (VAINF werden))) ($. .),1,0,0
Und man kann mehr Muskeln bekommen.,(S (KON Und) (PIS man) (VMFIN kann) (VP (NP (PIAT mehr) (NN Muskeln)) (VVINF bekommen))) ($. .),1,0,0
Eine bekannte Übung sind Knie-beugen.,(S (NP (ART Eine) (ADJA bekannte) (NN Übung)) (VAFIN sind) (NN Knie-beugen)) ($. .),1,1,0
Bei einer Kranken-kasse kann man Mitglied werden.,(S (PP (APPR Bei) (ART einer) (NN Kranken-kasse)) (VMFIN kann) (PIS man) (VP (NN Mitglied) (VAINF werden))) ($. .),1,0,0
Die Mitglieder müssen Geld zahlen.,(S (NP (ART Die) (NN Mitglieder)) (VMFIN müssen) (VP (NN Geld) (VVINF zahlen))) ($. .),1,0,0
"Wer wenig Geld hat, muss weniger Mitglieds-beitrag zahlen.","(S (PWS Wer) (NP (PIAT wenig) (NN Geld)) (VAFIN hat)) ($, ,) (S (VMFIN muss) (VP (NP (PIAT weniger) (NN Mitglieds-beitrag)) (VVINF zahlen))) ($. .)",1,0,0
"Wer mehr Geld hat, muss mehr Mitglieds-beitrag zahlen.","(S (PWS Wer) (NP (PIAT mehr) (NN Geld)) (VAFIN hat)) ($, ,) (S (VMFIN muss) (VP (NP (PIAT mehr) (NN Mitglieds-beitrag)) (VVINF zahlen))) ($. .)",1,0,0
Es gibt ein Gesetz.,(S (PPER Es) (VVFIN gibt) (NP (ART ein) (NN Gesetz))) ($. .),1,0,0
"Im Gesetz steht,  \newline was die Kranken-versicherung alles zahlen muss.","(S (PP (APPRART Im) (NN Gesetz)) (VVFIN steht)) ($, ,) ($.  ) (S (ADV \newline) (S (PWS was) (NP (ART die) (NN Kranken-versicherung)) (VP (NP (PIS alles)) (VVINF zahlen)) (VMFIN muss))) ($. .)",1,0,0
Die Kranken-kasse zahlt die Rechnungen der Mitglieder.,(S (NP (ART Die) (NN Kranken-kasse)) (VVFIN zahlt) (NP (ART die) (NN Rechnungen) (NP (ART der) (NN Mitglieder)))) ($. .),1,1,0
Die Kranken-kasse zahlt zum Beispiel für: • den Arzt,(S (NP (ART Die) (NN Kranken-kasse)) (VVFIN zahlt) (PP (APPRART zum) (NN Beispiel)) (APPR für)) ($. :),1,0,0
Die Kranken-kasse zahlt zum Beispiel für: • den Zahn-arzt,(S (NP (ART Die) (NN Kranken-kasse)) (VVFIN zahlt) (PP (APPRART zum) (NN Beispiel)) (APPR für)) ($. :),1,0,0
Die Kranken-kasse zahlt zum Beispiel für: • für das Kranken-haus,(S (NP (ART Die) (NN Kranken-kasse)) (VVFIN zahlt) (PP (APPRART zum) (NN Beispiel)) (APPR für)) ($. :),1,0,0
Die Kranken-kasse zahlt zum Beispiel für: • Medikamente,(S (NP (ART Die) (NN Kranken-kasse)) (VVFIN zahlt) (PP (APPRART zum) (NN Beispiel)) (APPR für)) ($. :),1,0,0
Die Kranken-kasse zahlt zum Beispiel für: • die Therapie,(S (NP (ART Die) (NN Kranken-kasse)) (VVFIN zahlt) (PP (APPRART zum) (NN Beispiel)) (APPR für)) ($. :),1,0,0
Die Kranken-kasse zahlt zum Beispiel für: • die Reha,(S (NP (ART Die) (NN Kranken-kasse)) (VVFIN zahlt) (PP (APPRART zum) (NN Beispiel)) (APPR für)) ($. :),1,0,0
Die Kranken-kasse zahlt zum Beispiel für: • eine Brille,(S (NP (ART Die) (NN Kranken-kasse)) (VVFIN zahlt) (PP (APPRART zum) (NN Beispiel)) (APPR für)) ($. :),1,0,0
Manchmal müssen die Mitglieder Geld dazu geben.,(S (ADV Manchmal) (VMFIN müssen) (NP (ART die) (NN Mitglieder)) (VP (NN Geld) (PROAV dazu) (VVINF geben))) ($. .),1,0,0
In Deutschland sagen die Leute zu dem Geld Eigen-anteil.,(S (PP (APPR In) (NE Deutschland)) (VVFIN sagen) (NP (ART die) (NN Leute)) (PP (APPR zu) (ART dem) (NN Geld)) (NN Eigen-anteil)) ($. .),1,0,0
In der Schweiz sagen die Leute zu dem Geld Franchise.,(S (PP (APPR In) (ART der) (NE Schweiz)) (VVFIN sagen) (NP (ART die) (NN Leute)) (PP (APPR zu) (ART dem) (NN Geld)) (NN Franchise)) ($. .),1,0,0
Die Mitglieder bekommen eine Kranken-versicherungs-karte.,(S (NP (ART Die) (NN Mitglieder)) (VVFIN bekommen) (NP (ART eine) (NN Kranken-versicherungs-karte))) ($. .),1,0,0
In Deutschland gibt es die Elektronische Gesundheits-karte.,(S (PP (APPR In) (NE Deutschland)) (VVFIN gibt) (PPER es) (NP (ART die) (ADJA Elektronische) (NN Gesundheits-karte))) ($. .),1,1,0
Die Elektronische Gesundheits-karte gibt es seit dem Jahr 2004. \newline  \newline In Österreich gibt es die e-Card.,(NP (ART Die) (ADJA Elektronische) (NN Gesundheits-karte)) (VVFIN gibt) (PPER es) (APPR seit) (ART dem) (NN Jahr) ($. 2004.),0,1,0
In Deutschland gibt es 2 Kranken-kassen: \newline Es gibt die GKV. \newline Und es gibt die PKV.,(S (PP (APPR In) (NE Deutschland)) (VVFIN gibt) (PPER es) (NP (CARD 2) (NN Kranken-kassen))) ($. :),1,0,0
Eine Kranken-kasse ist eine Firma.,(S (NP (ART Eine) (NN Kranken-kasse)) (VAFIN ist) (NP (ART eine) (NN Firma))) ($. .),1,0,0
Genauer: eine Versicherungs-firma.,(ADJD Genauer) ($. :) (NP (ART eine) (NN Versicherungs-firma)) ($. .),0,0,0
Die Kranken-kasse hilft Leuten.,(S (NP (ART Die) (NN Kranken-kasse)) (VVFIN hilft) (NN Leuten)) ($. .),1,0,0
Die Leute müssen Mitglied bei der Kranken-kasse sein.,(S (NP (ART Die) (NN Leute)) (VMFIN müssen) (VP (NP (NN Mitglied) (PP (APPR bei) (ART der) (NN Kranken-kasse))) (VAINF sein))) ($. .),1,1,0
Dann zahlt die Kranken-kasse manche Rechnungen.,(S (ADV Dann) (VVFIN zahlt) (NP (ART die) (NN Kranken-kasse)) (NP (PIAT manche) (NN Rechnungen))) ($. .),1,0,0
Zum Beispiel die Rechnung vom Arzt.,(NP (PP (APPRART Zum) (NN Beispiel)) (ART die) (NN Rechnung) (PP (APPRART vom) (NN Arzt))) ($. .),0,1,0
Es ist ein Schutz wenn man krank ist.,(S (PPER Es) (VAFIN ist) (NP (ART ein) (NN Schutz)) (S (KOUS wenn) (PIS man) (ADJD krank) (VAFIN ist))) ($. .),1,0,0
Oder wenn man einen Unfall hat.,(S (KON Oder) (S (KOUS wenn) (PIS man) (NP (ART einen) (NN Unfall)) (VAFIN hat))) ($. .),1,0,0
Das kurze Wort für Kranken-versicherungs-karte ist: KVK. \newline Die KVK gibt es seit dem Jahr 1995. \newline Seit dem Jahr 2012 wird die KVK langsam abgeschafft.,(S (NP (ART Das) (ADJA kurze) (NN Wort) (PP (APPR für) (NN Kranken-versicherungs-karte))) (VAFIN ist)) ($. :) (NN KVK) ($. .),1,1,0
Auf der KVK sind verschiedene Daten gespeichert.,(S (PP (APPR Auf) (ART der) (NN KVK)) (VAFIN sind) (NP (ADJA verschiedene) (NN Daten)) (VP (VVPP gespeichert))) ($. .),1,0,0
Zum Beispiel: • Von welcher Kranken-kasse die Karte ist,(PP (APPRART Zum) (NN Beispiel)) ($. :) ($LRB •) (S (PP (APPR Von) (PWAT welcher) (NN Kranken-kasse)) (NP (ART die) (NN Karte)) (VAFIN ist)),1,0,0
Zum Beispiel: • Vorname,(PP (APPRART Zum) (NN Beispiel)) ($. :) (XY •) (NN Vorname),0,0,0
Zum Beispiel: • Familienname,(PP (APPRART Zum) (NN Beispiel)) ($. :) (XY •) (NN Familienname),0,0,0
Zum Beispiel: • Geburtsdatum,(PP (APPRART Zum) (NN Beispiel)) ($. :) (XY •) (NN Geburtsdatum),0,0,0
Zum Beispiel: • Adresse,(PP (APPRART Zum) (NN Beispiel)) ($. :) (XY •) (NN Adresse),0,0,0
Mit der KVK kann man zum Arzt gehen.,(S (PP (APPR Mit) (ART der) (NN KVK)) (VMFIN kann) (PIS man) (VP (PP (APPRART zum) (NN Arzt)) (VVINF gehen))) ($. .),1,0,0
Der Arzt kann die Daten auf der Karte lesen.,(S (NP (ART Der) (NN Arzt)) (VMFIN kann) (VP (NP (ART die) (NN Daten) (PP (APPR auf) (ART der) (NN Karte))) (VVINF lesen))) ($. .),1,1,0
Der Arzt kann dann seine Rechnung an die Kranken-kasse schicken.,(S (NP (ART Der) (NN Arzt)) (VMFIN kann) (ADV dann) (VP (NP (PPOSAT seine) (NN Rechnung)) (PP (APPR an) (ART die) (NN Kranken-kasse)) (VVINF schicken))) ($. .),1,0,0
Die KVK soll abgeschafft werden.,(S (NP (ART Die) (NN KVK)) (VMFIN soll) (VP (VVPP abgeschafft) (VAINF werden))) ($. .),1,0,0
Dann soll es eine andere Chip-Karte geben.,(S (ADV Dann) (VMFIN soll) (PPER es) (VP (NP (ART eine) (ADJA andere) (NN Chip-Karte)) (VVINF geben))) ($. .),1,1,0
Die Elektronische Gesundheits-karte.,(NP (ART Die) (ADJA Elektronische) (NN Gesundheits-karte)) ($. .),0,1,0
Auf dieser Karte können mehr Daten gespeichert werden.,(S (PP (APPR Auf) (PDAT dieser) (NN Karte)) (VMFIN können) (NP (PIAT mehr) (NN Daten)) (VP (VVPP gespeichert) (VAINF werden))) ($. .),1,0,0
Die Kranken-versicherungs-karte ist eine Chip Karte.,(S (NP (ART Die) (NN Kranken-versicherungs-karte)) (VAFIN ist) (NP (ART eine) (TRUNC Chip) (NN Karte))) ($. .),1,1,0
Diese Karte gibt es in Deutschland.,(S (NP (PDAT Diese) (NN Karte)) (VVFIN gibt) (PPER es) (PP (APPR in) (NE Deutschland))) ($. .),1,0,0
Die Menschen in Deutschland bekommen die Karte von ihrer Kranken-versicherung.,(S (NP (ART Die) (NN Menschen) (PP (APPR in) (NE Deutschland))) (VVFIN bekommen) (NP (ART die) (NN Karte)) (PP (APPR von) (PPOSAT ihrer) (NN Kranken-versicherung))) ($. .),1,1,0
In Österreich gibt es eine ähnliche Karte.,(S (PP (APPR In) (NE Österreich)) (VVFIN gibt) (PPER es) (NP (ART eine) (ADJA ähnliche) (NN Karte))) ($. .),1,1,0
In Österreich heißt die Karte: e-card,(S (PP (APPR In) (NE Österreich)) (VVFIN heißt) (NP (ART die) (NN Karte))) ($. :) (NE e-card),1,0,0
"Wenn du krank bist,  \newline dann gehst du vielleicht zum Arzt.","(S (KOUS Wenn) (PPER du) (ADJD krank) (VAFIN bist)) ($, ,) ($.  )",1,0,0
Du gibst beim Arzt deine Kranken-versicherungs-karte ab  \newline und der Arzt behandelt dich.,(CS (S (PPER Du) (VVFIN gibst) (PP (APPRART beim) (NN Arzt)) (NP (PPOSAT deine) (NN Kranken-versicherungs-karte)) (PTKVZ ab))) ($.  ) (NE \newline) (KON und) (S (NP (ART der) (NN Arzt)) (VVFIN behandelt) (PPER dich)) ($. .),1,0,0
Du musst für die Behandlung nichts zahlen.,(S (PPER Du) (VMFIN musst) (VP (PP (APPR für) (ART die) (NN Behandlung)) (PIS nichts) (VVINF zahlen))) ($. .),1,0,0
Deine Kranken-versicherung zahlt die Behandlung.,(S (NP (PPOSAT Deine) (NN Kranken-versicherung)) (VVFIN zahlt) (NP (ART die) (NN Behandlung))) ($. .),1,0,0
"Wenn du arbeiten gehst,  \newline dann zahlen zwei Personen deine Kranken-versicherung:  \newline dein Chef und du.","(S (KOUS Wenn) (PPER du) (VVINF arbeiten) (VVFIN gehst)) ($, ,) (S ($.  ) (S (ADV \newline) (ADV dann) (VVFIN zahlen) (CARD zwei) (NN Personen) (NP (PPOSAT deine) (NN Kranken-versicherung)))) ($LRB :) ($.  ) (NE \newline) (CNP (NP (PPOSAT dein) (NN Chef)) (KON und) (PPER du)) ($. .)",1,0,0
Dein Chef zahlt die Hälfte vom Geld für deine Kranken-versicherung.,(S (NP (PPOSAT Dein) (NN Chef)) (VVFIN zahlt) (NP (ART die) (NN Hälfte) (PP (APPRART vom) (NN Geld))) (PP (APPR für) (PPOSAT deine) (NN Kranken-versicherung))) ($. .),1,1,0
Du zahlst die andere Hälfte vom Geld für deine Kranken-versicherung.,(S (PPER Du) (VVFIN zahlst) (NP (ART die) (ADJA andere) (NN Hälfte) (PP (APPRART vom) (NN Geld))) (PP (APPR für) (PPOSAT deine) (NN Kranken-versicherung))) ($. .),1,1,0
Eine Kranken-versicherung ist eine Ab-sicherung.,(S (NP (ART Eine) (NN Kranken-versicherung)) (VAFIN ist) (NP (ART eine) (NN Ab-sicherung))) ($. .),1,0,0
Es ist eine Ab-sicherung gegen krank sein.,(S (PPER Es) (VAFIN ist) (NP (ART eine) (NN Ab-sicherung) (PP (APPR gegen) (VP (ADJD krank) (VAINF sein))))) ($. .),1,1,0
"Wenn du krank bist,  \newline dann zahlt eine Kranken-kasse den Arzt.","(AVP (S (KOUS Wenn) (PPER du) (ADJD krank) (VAFIN bist))) ($, ,) ($.  ) (S (AVP (FM \newline) (ADV dann)) (VVFIN zahlt) (NP (ART eine) (NN Kranken-kasse)) (NP (ART den) (NN Arzt))) ($. .)",1,0,0
Oder die Kranken-kasse bezahlt das Kranken-haus.,(S (KON Oder) (NP (ART die) (NN Kranken-kasse)) (VVFIN bezahlt) (NP (ART das) (NN Kranken-haus))) ($. .),1,0,0
Du kannst zu einer Kranken-versicherung auch Kranken-kasse sagen.,(S (PPER Du) (VMFIN kannst) (VP (PP (APPR zu) (ART einer) (NN Kranken-versicherung)) (ADV auch) (NN Kranken-kasse) (VVINF sagen))) ($. .),1,0,0
Bei einer Krankheit funktionieren Körper-teile schlecht.,(S (PP (APPR Bei) (ART einer) (NN Krankheit)) (VVFIN funktionieren) (NN Körper-teile) (ADJD schlecht)) ($. .),1,0,0
Oder der Geist funktioniert schlecht.,(S (KON Oder) (NP (ART der) (NN Geist)) (VVFIN funktioniert) (ADJD schlecht)) ($. .),1,0,0
Eine Krankheit kann durch viele Dinge passieren.,(S (NP (ART Eine) (NN Krankheit)) (VMFIN kann) (VP (PP (APPR durch) (PIAT viele) (NN Dinge)) (VVINF passieren))) ($. .),1,0,0
Zum Beispiel wegen schlechtem Essen.,(PP (PP (APPRART Zum) (NN Beispiel)) (APPR wegen) (ADJA schlechtem) (NN Essen)) ($. .),0,0,1
Oder durch un-sauberes Wasser.,(KON Oder) (PP (APPR durch) (ADJA un-sauberes) (NN Wasser)) ($. .),0,0,0
Oder durch Viren.,(CPP (KON Oder) (PP (APPR durch) (NN Viren))),0,0,0
Arbeiten kann auch un-gesund sein.,(S (NN Arbeiten) (VMFIN kann) (ADV auch) (VP (ADJD un-gesund) (VAINF sein))) ($. .),1,0,0
Und krank machen.,(S (KON Und) (VP (ADJD krank) (VVINF machen))) ($. .),1,0,0
Krankheiten kann man mit Medikamenten behandeln.,(S (NN Krankheiten) (VMFIN kann) (PIS man) (VP (PP (APPR mit) (NN Medikamenten)) (VVINF behandeln))) ($. .),1,0,0
Zum Beispiel bei einer Infektion mit Anti-biotika.,(PP (PP (APPRART Zum) (NN Beispiel)) (APPR bei) (ART einer) (NN Infektion) (PP (APPR mit) (NN Anti-biotika))) ($. .),0,0,1
Oder mit einer Operation.,(S (KON Oder) (PP (APPR mit) (ART einer) (NN Operation))) ($. .),0,0,0
"Ein Mensch der eine Krankheit hat, \newline nennt man Kranker.",(ART Ein) (NN Mensch) (S (PRELS der) (NP (ART eine) (NN Krankheit)) (VAFIN hat)),1,0,0
"Jemand der eine Krankheit behandelt, nennt man Arzt.","(PIS Jemand) (S (PRELS der) (NP (ART eine) (NN Krankheit)) (VVFIN behandelt)) ($, ,) (S (VVFIN nennt) (PIS man) (NN Arzt)) ($. .)",1,0,0
Krankheiten untersuchen Experten von der Patho-logie.,(S (NN Krankheiten) (VVFIN untersuchen) (NP (NN Experten) (PP (APPR von) (ART der) (NN Patho-logie)))) ($. .),1,1,0
Die Experten sind Patho-logen.,(S (NP (ART Die) (NN Experten)) (VAFIN sind) (NN Patho-logen)) ($. .),1,0,0
"Warum es Krankheiten gibt, untersuchen Experten von der Epi-demiologie.","(S (PWAV Warum) (PPER es) (NN Krankheiten) (VVFIN gibt)) ($, ,) (S (VVFIN untersuchen) (NP (NN Experten) (PP (APPR von) (ART der) (NN Epi-demiologie)))) ($. .)",1,1,0
Die Experten sind Epidemio-logen.,(S (NP (ART Die) (NN Experten)) (VAFIN sind) (NN Epidemio-logen)) ($. .),1,0,0
Krankheit ist etwas un-gesundes.,(S (NN Krankheit) (VAFIN ist) (NP (PIAT etwas) (ADJA un-gesundes))) ($. .),1,0,0
Im Körper vom Mensch passiert etwas Schlimmes.,(S (PP (APPRART Im) (NN Körper) (PP (APPRART vom) (NN Mensch))) (VVFIN passiert) (NP (PIAT etwas) (NN Schlimmes))) ($. .),1,0,1
Dadurch kann man Schmerzen haben.,(S (PROAV Dadurch) (VMFIN kann) (PIS man) (VP (NN Schmerzen) (VAINF haben))) ($. .),1,0,0
Oder Körper-teile funktionieren schlecht.,(S (KON Oder) (NN Körper-teile) (VVFIN funktionieren) (ADJD schlecht)) ($. .),1,0,0
Oder man kann sterben.,(S (KON Oder) (PIS man) (VMFIN kann) (VVINF sterben)) ($. .),1,0,0
Krankheit kann auch im Geist sein.,(S (NN Krankheit) (VMFIN kann) (VP (PP (ADV auch) (APPRART im) (NN Geist)) (VAINF sein))) ($. .),1,0,0
Dann kann es eine Psychische Störung geben.,(S (ADV Dann) (VMFIN kann) (PPER es) (VP (NP (ART eine) (ADJA Psychische) (NN Störung)) (VVINF geben))) ($. .),1,1,0
Das Wort Krass wird oft von Jugendlichen benutzt.,(S (NP (ART Das) (NN Wort) (NN Krass)) (VAFIN wird) (VP (ADV oft) (PP (APPR von) (NN Jugendlichen)) (VVPP benutzt))) ($. .),1,1,0
Beispiel: \newline Michael findet den Horrorfilm krass.,(NN Beispiel) ($. :) (S (PN (NE \newline) (NE Michael)) (VVFIN findet) (NP (ART den) (NN Horrorfilm)) (ADJD krass)) ($. .),1,0,0
Michael findet den Horrorfilm extrem.,(S (NE Michael) (VVFIN findet) (NP (ART den) (NN Horrorfilm)) (ADJD extrem)) ($. .),1,0,0
Michael findet den Horrorfilm besonders.,(S (NE Michael) (VVFIN findet) (NP (ART den) (NN Horrorfilm)) (ADV besonders)) ($. .),1,0,0
Krass ist ein Adjektiv.,(S (ADJD Krass) (VAFIN ist) (NP (ART ein) (NN Adjektiv))) ($. .),1,0,0
"Das Gegenteil von krass ist ""durchschnittlich"", oder ""alltäglich"".","(S (NP (ART Das) (NN Gegenteil) (PP (APPR von) (ADJD krass))) (VAFIN ist)) ($LRB "") (CAP (ADJD durchschnittlich)) ($LRB "") ($, ,) (KON oder) ($LRB "") (ADJD alltäglich) ($LRB "") ($. .)",1,1,0
Krass ist ein ein anderes Wort für besonders.,(S (NN Krass) (VAFIN ist) (NP (ART ein) (ART ein) (ADJA anderes) (NN Wort) (PP (APPR für) (ADV besonders)))) ($. .),1,1,0
Krawatten werden um den Hals gebunden.,(S (NN Krawatten) (VAFIN werden) (VP (PP (APPR um) (ART den) (NN Hals)) (VVPP gebunden))) ($. .),1,0,0
Mit einem Krawattenknoten.,(PP (APPR Mit) (ART einem) (NN Krawattenknoten)) ($. .),0,0,0
Man kann die Krawatte zum Beispiel zu einem Hemd tragen.,(S (PIS Man) (VMFIN kann) (VP (NP (ART die) (NN Krawatte)) (PP (PP (APPRART zum) (NN Beispiel)) (APPR zu) (ART einem) (NN Hemd)) (VVINF tragen))) ($. .),1,0,1
Es gibt Krawatten aus verschiedenem Material.,(S (PPER Es) (VVFIN gibt) (NP (NN Krawatten) (PP (APPR aus) (ADJA verschiedenem) (NN Material)))) ($. .),1,1,0
Zum Beispiel: • Leder,(PP (APPRART Zum) (NN Beispiel)) ($. :) (XY •) (NN Leder),0,0,0
Zum Beispiel: • Hanf,(PP (APPRART Zum) (NN Beispiel)) ($. :) (XY •) (NN Hanf),0,0,0
Zum Beispiel: • Holz,(PP (APPRART Zum) (NN Beispiel)) ($. :) (XY •) (NN Holz),0,0,0
Zum Beispiel: • Metall,(PP (APPRART Zum) (NN Beispiel)) ($. :) (XY •) (NN Metall),0,0,0
Zum Beispiel: • Glas,(PP (APPRART Zum) (NN Beispiel)) ($. :) (XY •) (NN Glas),0,0,0
Es gibt Krawatten in verschiedene Farben.,(S (PPER Es) (VVFIN gibt) (NP (NN Krawatten) (PP (APPR in) (ADJA verschiedene) (NN Farben)))) ($. .),1,1,0
Früher haben hauptsächlich Männer Krawatten angezogen.,(S (ADJD Früher) (VAFIN haben) (NP (ADJD hauptsächlich) (NN Männer)) (VP (NN Krawatten) (VVPP angezogen))) ($. .),1,0,0
Heute ziehen auch manche Frauen Krawatten an.,(S (ADV Heute) (VVFIN ziehen) (NP (ADV auch) (PIAT manche) (NN Frauen)) (NN Krawatten) (PTKVZ an)) ($. .),1,1,0
Hier werden Krawatten oft getragen: • Privatschulen,(S (ADV Hier) (VAFIN werden) (NN Krawatten) (VP (ADV oft) (VVPP getragen))) ($. :),1,0,0
Hier werden Krawatten oft getragen: • Berufen,(S (ADV Hier) (VAFIN werden) (NN Krawatten) (VP (ADV oft) (VVPP getragen))) ($. :),1,0,0
Hier werden Krawatten oft getragen: • feierliche Anlässe,(S (ADV Hier) (VAFIN werden) (NN Krawatten) (VP (ADV oft) (VVPP getragen))) ($. :),1,0,0
