sentence,tree,is_sent,big_np_count,big_pp_count
Ein Anrainer ist ein Nachbar.,(S (NP (ART Ein) (NN Anrainer)) (VAFIN ist) (NP (ART ein) (NN Nachbar))) ($. .),1,0,0
Das heißt: \newline jemand wohnt neben dran,(S (PDS Das) (VVFIN heißt)) ($. :) (NE \newline),1,0,0
Der Mann hat absichtlich auf die Menschen geschossen.,(S (NP (ART Der) (NN Mann)) (VAFIN hat) (VP (ADJD absichtlich) (PP (APPR auf) (ART die) (NN Menschen)) (VVPP geschossen))) ($. .),1,0,0
Keiner weiß wer der Mann ist.,(S (PIS Keiner) (VVFIN weiß) (S (PWS wer) (NP (ART der) (NN Mann)) (VAFIN ist))) ($. .),1,0,0
Und warum er das gemacht hat.,(S (KON Und) (PWAV warum) (PPER er) (VP (PDS das) (VVPP gemacht)) (VAFIN hat)) ($. .),1,0,0
Und keiner weiß wo der Mann ist.,(S (KON Und) (PIS keiner) (VVFIN weiß) (S (PWAV wo) (NP (ART der) (NN Mann)) (VAFIN ist))) ($. .),1,0,0
Er ist danach abgehauen.,(S (PPER Er) (VAFIN ist) (VP (PROAV danach) (VVPP abgehauen))) ($. .),1,0,0
Die Polizei und Experten versuchen heraus zu finden wer der Mann ist.,(S (CNP (NP (ART Die) (NN Polizei)) (KON und) (NN Experten)) (VVFIN versuchen) (VP (VP (PTKVZ heraus) (VZ (PTKZU zu) (VVINF finden))) (PWS wer) (NP (ART der) (NN Mann)) (VAFIN ist))) ($. .),1,0,0
Und wo der Mann sich versteckt hat.,(S (KON Und) (PWAV wo) (NP (ART der) (NN Mann)) (VP (PRF sich) (VVPP versteckt)) (VAFIN hat)) ($. .),1,0,0
Die Polizei in der Türkei sagt: der Mann hat Terrorismus gemacht.,(S (NP (ART Die) (NN Polizei) (PP (APPR in) (ART der) (NE Türkei))) (VVFIN sagt)) ($. :) (S (NP (ART der) (NN Mann)) (VAFIN hat) (VP (NN Terrorismus) (VVPP gemacht))) ($. .),1,1,0
Und der Mann hat eine Lang-waffe zum schießen benutzt.,(S (KON Und) (NP (ART der) (NN Mann)) (VAFIN hat) (VP (NP (ART eine) (NN Lang-waffe)) (PP (APPRART zum) (NN schießen)) (VVPP benutzt))) ($. .),1,0,0
Die IS Gruppe hat gesagt: wir haben den Anschlag gemacht.,(S (NP (ART Die) (NE IS) (NN Gruppe)) (VAFIN hat) (VP (VVPP gesagt))) ($. :) (S (PPER wir) (VAFIN haben) (VP (NP (ART den) (NN Anschlag)) (VVPP gemacht))) ($. .),1,1,0
Und der Mann gehört zu unserer Gruppe.,(S (KON Und) (NP (ART der) (NN Mann)) (VVFIN gehört) (PP (APPR zu) (PPOSAT unserer) (NN Gruppe))) ($. .),1,0,0
Der Mann dem der Nacht-club gehört hat gesagt: der Geheim-dienst von den Vereinigte Staaten hat ihn gewarnt.,(S (NP (ART Der) (NN Mann)) (PRELS dem) (NP (ART der) (NN Nacht-club)) (VP (VVPP gehört)) (VAFIN hat) (VP (VVPP gesagt))) ($. :),1,0,0
Der Geheim-dienst hat gesagt es gibt einen Anschlag auf den Nacht-club.,(S (NP (ART Der) (NN Geheim-dienst)) (VAFIN hat) (VP (VVPP gesagt)) (S (PPER es) (VVFIN gibt) (NP (ART einen) (NN Anschlag) (PP (APPR auf) (ART den) (NN Nacht-club))))) ($. .),1,1,0
Der Geheim-dienst von Amerika sagt das stimmt nicht.,(S (NP (ART Der) (NN Geheim-dienst) (PP (APPR von) (NE Amerika))) (VVFIN sagt) (S (PDS das) (VVFIN stimmt) (PTKNEG nicht))) ($. .),1,1,0
"Angela Merkel hat gesagt, \newline dass der Anschlag böse und schrecklich gewesen ist.","(S (PN (NE Angela) (NE Merkel)) (VAFIN hat) (VP (VVPP gesagt))) ($, ,) (S (ADV \newline) (KOUS dass) (NP (ART der) (NN Anschlag)) (VP (CAP (ADJD böse) (KON und) (ADJD schrecklich)) (VAPP gewesen)) (VAFIN ist)) ($. .)",1,0,0
Sie denkt an die gestorbenen Menschen.,(S (PPER Sie) (VVFIN denkt) (PP (APPR an) (ART die) (ADJA gestorbenen) (NN Menschen))) ($. .),1,0,1
Und an die verletzten Menschen.,(S (KON Und) (PP (APPR an) (ART die) (ADJA verletzten) (NN Menschen))) ($. .),0,0,1
In der Türkei hat es schon viele Anschläge gegeben.,(S (PP (APPR In) (ART der) (NE Türkei)) (VAFIN hat) (PPER es) (VP (ADV schon) (NP (PIAT viele) (NN Anschläge)) (VVPP gegeben))) ($. .),1,0,0
Im Jahr 2016 hat es 20 Anschläge gegeben.,(S (PP (APPRART Im) (NN Jahr) (CARD 2016)) (VAFIN hat) (PPER es) (VP (NP (CARD 20) (NN Anschläge)) (VVPP gegeben))) ($. .),1,0,0
Zum Beispiel am 12. Januar 2016. \newline Oder am 17. Februar 2016 in Ankara.,(PP (APPRART Zum) (NN Beispiel)) (APPRART am) (ADJA 12.) (NN Januar) ($. 2016.),0,0,0
Oder am 10. Dezember in Istanbul.,(S (KON Oder) (PP (APPRART am) (ADJA 10.) (NN Dezember)) (PP (APPR in) (NE Istanbul))) ($. .),0,0,0
Der Anschlag in Istanbul ist am 1. Januar 2017 gewesen.,(S (NP (ART Der) (NN Anschlag) (PP (APPR in) (NE Istanbul))) (VAFIN ist) (VP (PP (APPRART am) (ADJA 1.) (NN Januar) (CARD 2017)) (VAPP gewesen))) ($. .),1,1,1
Dabei sind 37 Menschen getötet.,(S (PROAV Dabei) (VAFIN sind) (NP (CARD 37) (NN Menschen)) (VP (VVPP getötet))) ($. .),1,0,0
Und sehr viele Menschen sind verletzt.,(S (KON Und) (NP (AP (ADV sehr) (PIAT viele)) (NN Menschen)) (VAFIN sind) (VVPP verletzt)) ($. .),1,1,0
Ein Mann hat mit einer Waffe auf viele Menschen geschossen.,(S (NP (ART Ein) (NN Mann)) (VAFIN hat) (VP (PP (APPR mit) (ART einer) (NN Waffe)) (PP (APPR auf) (PIAT viele) (NN Menschen)) (VVPP geschossen))) ($. .),1,0,0
Gemacht hat das der Mann in einem Nacht-club.,(S (VP (VVPP Gemacht)) (VAFIN hat) (PDS das) (NP (ART der) (NN Mann)) (PP (APPR in) (ART einem) (NN Nacht-club))) ($. .),1,0,0
Viele Menschen haben dort gefeiert.,(S (NP (PIAT Viele) (NN Menschen)) (VAFIN haben) (VP (ADV dort) (VVPP gefeiert))) ($. .),1,0,0
Im Nacht-club haben über 700 Menschen gefeiert.,(S (PP (APPRART Im) (NN Nacht-club)) (VAFIN haben) (NP (AP (ADV über) (CARD 700)) (NN Menschen)) (VP (VVPP gefeiert))) ($. .),1,1,0
Der Anschlag ist in der Stadt Istanbul gewesen.,(S (NP (ART Der) (NN Anschlag)) (VAFIN ist) (VP (PP (APPR in) (ART der) (NN Stadt) (NE Istanbul)) (VAPP gewesen))) ($. .),1,0,1
Das ist in der Türkei.,(S (PDS Das) (VAFIN ist) (PP (APPR in) (ART der) (NE Türkei))) ($. .),1,0,0
Am 10. Dezember 2016 hat es diese 2 Anschläge gegeben.,(S (PP (APPRART Am) (ADJA 10.) (NN Dezember) (CARD 2016)) (VAFIN hat) (PPER es) (VP (NP (PDAT diese) (CARD 2) (NN Anschläge)) (VVPP gegeben))) ($. .),1,1,1
Der Anschlag in Istanbul ist am 10. Dezember 2016 gewesen.,(S (NP (ART Der) (NN Anschlag) (PP (APPR in) (NE Istanbul))) (VAFIN ist) (VP (PP (APPRART am) (ADJA 10.) (NN Dezember) (CARD 2016)) (VAPP gewesen))) ($. .),1,1,1
Dabei sind 44 Menschen getötet.,(S (PROAV Dabei) (VAFIN sind) (NP (CARD 44) (NN Menschen)) (VP (VVPP getötet))) ($. .),1,0,0
Und viele Menschen sind verletzt.,(S (KON Und) (NP (PIAT viele) (NN Menschen)) (VAFIN sind) (VVPP verletzt)) ($. .),1,0,0
Jemand hat ein Auto in die Luft gesprengt.,(S (PIS Jemand) (VAFIN hat) (VP (NP (ART ein) (NN Auto)) (PP (APPR in) (ART die) (NN Luft)) (VVPP gesprengt))) ($. .),1,0,0
Und ein Mann hat sich in die Luft gesprengt.,(S (KON Und) (NP (ART ein) (NN Mann)) (VAFIN hat) (VP (PRF sich) (PP (APPR in) (ART die) (NN Luft)) (VVPP gesprengt))) ($. .),1,0,0
Die Täter haben das absichtlich gemacht.,(S (NP (ART Die) (NN Täter)) (VAFIN haben) (VP (PDS das) (ADJD absichtlich) (VVPP gemacht))) ($. .),1,0,0
Sie haben viele Menschen töten und verletzen wollen.,(S (PPER Sie) (VAFIN haben) (VP (CVP (VP (NP (PIAT viele) (NN Menschen)) (VVINF töten)) (KON und) (VP (VVINF verletzen))) (VMINF wollen))) ($. .),1,0,0
Die Täter sind dabei selbst gestorben.,(S (NP (ART Die) (NN Täter)) (VAFIN sind) (PROAV dabei) (NP (ADV selbst)) (VP (VVPP gestorben))) ($. .),1,0,0
Der Anschlag ist in der Stadt Istanbul gewesen.,(S (NP (ART Der) (NN Anschlag)) (VAFIN ist) (VP (PP (APPR in) (ART der) (NN Stadt) (NE Istanbul)) (VAPP gewesen))) ($. .),1,0,1
"Der Mann der sich in die Luft gesprengt hat, \newline ist ein Selbst-mord-Attentäter.","(ART Der) (NN Mann) (PRELS der) (VP (PRF sich) (PP (APPR in) (ART die) (NN Luft)) (VVPP gesprengt)) (VAFIN hat) ($, ,) (S (NE \newline) (VAFIN ist) (NP (ART ein) (NN Selbst-mord-Attentäter))) ($. .)",1,0,0
Sein Name ist Nabil Fadli.,(S (NP (PPOSAT Sein) (NN Name)) (VAFIN ist) (PN (NE Nabil) (NE Fadli))) ($. .),1,0,0
Er hat sich an einem Platz mit vielen Menschen in die Luft gesprengt.,(S (PPER Er) (VAFIN hat) (VP (PRF sich) (PP (APPR an) (ART einem) (NN Platz) (PP (APPR mit) (PIAT vielen) (NN Menschen))) (PP (APPR in) (ART die) (NN Luft)) (VVPP gesprengt))) ($. .),1,0,1
"Nabil Fadli  hat sich zu den anderen Menschen gestellt und dann die Bombe gezündet, \newline Er ist dabei selbst gestorben.","(S (PN (NE Nabil) (NE Fadli)) (VAFIN  ) (CVP (VAFIN hat) (CVP (VP (PRF sich) (PP (APPR zu) (ART den) (ADJA anderen) (NN Menschen)) (VVPP gestellt)) (KON und) (VP (ADV dann) (NP (ART die) (NN Bombe)) (VVPP gezündet))))) ($, ,) (NE \newline)",1,0,1
Der Platz heißt Sultan-Ahmed-Platz und ist sehr bekannt.,(CS (S (NP (ART Der) (NN Platz)) (VVFIN heißt) (NE Sultan-Ahmed-Platz)) (KON und) (S (VAFIN ist) (AP (ADV sehr) (ADJD bekannt)))) ($. .),1,0,0
Sehr viele Touristen besuchen den Platz.,(S (NP (AP (ADV Sehr) (PIAT viele)) (NN Touristen)) (VVFIN besuchen) (NP (ART den) (NN Platz))) ($. .),1,1,0
Nabil Fadli ist 28 Jahre alt gewesen.,(S (PN (NE Nabil) (NE Fadli)) (VAFIN ist) (VP (AP (NP (CARD 28) (NN Jahre)) (ADJD alt)) (VAPP gewesen))) ($. .),1,0,0
Er gehört zur IS Gruppe.,(S (PPER Er) (VVFIN gehört) (PP (APPRART zur) (NE IS) (NN Gruppe))) ($. .),1,0,0
Nach dem Anschlag hat es eine Nachrichten-sperre gegeben.,(S (PP (APPR Nach) (ART dem) (NN Anschlag)) (VAFIN hat) (PPER es) (VP (NP (ART eine) (NN Nachrichten-sperre)) (VVPP gegeben))) ($. .),1,0,0
"Das heißt,  \newline Informationen weiter zu geben ist verboten.","(S (PDS Das) (VVFIN heißt)) ($, ,) ($.  ) (S (VP (NP (ADJA \newline) (NN Informationen)) (ADV weiter) (VZ (PTKZU zu) (VVINF geben))) (VAFIN ist) (VVPP verboten)) ($. .)",1,0,0
10 Menschen sind bei dem Anschlag getötet worden.,(S (NP (CARD 10) (NN Menschen)) (VAFIN sind) (VP (VP (PP (APPR bei) (ART dem) (NN Anschlag)) (VVPP getötet)) (VAPP worden))) ($. .),1,0,0
8 Menschen kommen aus Deutschland und eine Person kommt aus Peru.,(CS (S (NP (CARD 8) (NN Menschen)) (VVFIN kommen) (PP (APPR aus) (NE Deutschland))) (KON und) (S (NP (ART eine) (NN Person)) (VVFIN kommt) (PP (APPR aus) (NE Peru)))) ($. .),1,0,0
Der Anschlag in Istanbul ist am 12. Januar 2016 gewesen.,(S (NP (ART Der) (NN Anschlag) (PP (APPR in) (NE Istanbul))) (VAFIN ist) (VP (PP (APPRART am) (ADJA 12.) (NN Januar) (CARD 2016)) (VAPP gewesen))) ($. .),1,1,1
Dabei sind 10 Menschen getötet worden.,(S (PROAV Dabei) (VAFIN sind) (NP (CARD 10) (NN Menschen)) (VP (VP (VVPP getötet)) (VAPP worden))) ($. .),1,0,0
Und viele Menschen sind verletzt worden.,(S (KON Und) (NP (PIAT viele) (NN Menschen)) (VAFIN sind) (VP (VVPP verletzt) (VAPP worden))) ($. .),1,0,0
Ein Mann hat sich auf einem Platz mit vielen Menschen in die Luft gesprengt.,(S (NP (ART Ein) (NN Mann)) (VAFIN hat) (VP (PRF sich) (PP (APPR auf) (ART einem) (NN Platz) (PP (APPR mit) (PIAT vielen) (NN Menschen))) (PP (APPR in) (ART die) (NN Luft)) (VVPP gesprengt))) ($. .),1,0,1
Das hat der Täter absichtlich gemacht.,(S (PDS Das) (VAFIN hat) (NP (ART der) (NN Täter)) (VP (ADJD absichtlich) (VVPP gemacht))) ($. .),1,0,0
Der Täter ist dabei selbst gestorben.,(S (NP (ART Der) (NN Täter)) (VAFIN ist) (PROAV dabei) (NP (ADV selbst)) (VP (VVPP gestorben))) ($. .),1,0,0
Der Anschlag ist in der Stadt Istanbul gewesen.,(S (NP (ART Der) (NN Anschlag)) (VAFIN ist) (VP (PP (APPR in) (ART der) (NN Stadt) (NE Istanbul)) (VAPP gewesen))) ($. .),1,0,1
Das ist in der Türkei.,(S (PDS Das) (VAFIN ist) (PP (APPR in) (ART der) (NE Türkei))) ($. .),1,0,0
Bei dem Attentat wurden 12 Menschen getötet.,(S (PP (APPR Bei) (ART dem) (NN Attentat)) (VAFIN wurden) (NP (CARD 12) (NN Menschen)) (VP (VVPP getötet))) ($. .),1,0,0
Und 11 Menschen wurden verletzt.,(S (KON Und) (NP (CARD 11) (NN Menschen)) (VAFIN wurden) (VVPP verletzt)) ($. .),1,0,0
Es war ein Terror Anschlag.,(S (PPER Es) (VAFIN war) (NP (ART ein) (NN Terror) (NN Anschlag))) ($. .),1,1,0
Der Anschlag auf Charlie Hebdo ist am 7. Januar 2015 passiert.,(S (NP (ART Der) (NN Anschlag) (PP (APPR auf) (PN (NE Charlie) (NE Hebdo)))) (VAFIN ist) (VP (PP (APPRART am) (ADJA 7.) (NN Januar) (CARD 2015)) (VVPP passiert))) ($. .),1,1,1
2 Männer haben mit Waffen auf andere Menschen geschossen.,(S (NP (CARD 2) (NN Männer)) (VAFIN haben) (VP (PP (APPR mit) (NN Waffen)) (PP (APPR auf) (ADJA andere) (NN Menschen)) (VVPP geschossen))) ($. .),1,0,0
Das ist in Paris in den Räumen von Charlie Hebdo passiert.,(S (PDS Das) (VAFIN ist) (VP (PP (APPR in) (NE Paris)) (PP (APPR in) (ART den) (NN Räumen) (PP (APPR von) (PN (NE Charlie) (NE Hebdo)))) (VVPP passiert))) ($. .),1,0,1
Fußball-spieler von Borussia Dortmund sind mit dem Bus gefahren.,(S (NP (NN Fußball-spieler) (PP (APPR von) (PN (NP (NE Borussia) (NE Dortmund))))) (VAFIN sind) (VP (PP (APPR mit) (ART dem) (NN Bus)) (VVPP gefahren))) ($. .),1,1,0
Sie sind zu einem UEFA Spiel gefahren.,(S (PPER Sie) (VAFIN sind) (VP (PP (APPR zu) (ART einem) (NE UEFA) (NN Spiel)) (VVPP gefahren))) ($. .),1,0,1
Zum UEFA-spiel Borussia Dortmund gegen AS Monaco.,(PP (APPRART Zum) (NN UEFA-spiel)),0,0,0
Ein Mann hat auf der Straße 3 Spreng-bomben versteckt.,(S (NP (ART Ein) (NN Mann)) (VAFIN hat) (VP (PP (APPR auf) (ART der) (NN Straße)) (NP (CARD 3) (NN Spreng-bomben)) (VVPP versteckt))) ($. .),1,0,0
"Als der Bus mit den Fußball-spieler vorbei-gefahren ist, \newline sind die Spreng-bomben explodiert.","(KOUS Als) (NP (ART der) (NN Bus) (PP (APPR mit) (ART den) (NN Fußball-spieler))) (VVPP vorbei-gefahren) (VAFIN ist) ($, ,) (S (ADV \newline) (VAFIN sind) (NP (ART die) (NN Spreng-bomben)) (VP (VVPP explodiert))) ($. .)",1,1,0
Bei dem Anschlag ist ein Fußball-spieler und ein Polizist verletzt worden.,(S (PP (APPR Bei) (ART dem) (NN Anschlag)) (VAFIN ist) (CNP (NP (ART ein) (NN Fußball-spieler)) (KON und) (NP (ART ein) (NN Polizist))) (VP (VP (VVPP verletzt)) (VAPP worden))) ($. .),1,0,0
Das Fußball-spiel ist wegen dem Anschlag abgesagt worden.,(S (NP (ART Das) (NN Fußball-spiel)) (VAFIN ist) (VP (VP (PP (APPR wegen) (ART dem) (NN Anschlag)) (VVPP abgesagt)) (VAPP worden))) ($. .),1,0,0
"Manche sagen, \newline die IS Gruppe hat den Anschlag gemacht.","(S (PIS Manche) (VVFIN sagen)) ($, ,) (S (NP (FM \newline) (ART die) (NE IS) (NN Gruppe)) (VAFIN hat) (VP (NP (ART den) (NN Anschlag)) (VVPP gemacht))) ($. .)",1,1,0
"Die Polizei sagt,  \newline das ist falsch.","(S (NP (ART Die) (NN Polizei)) (VVFIN sagt)) ($, ,) ($.  ) (S (XY \newline) (S (PDS das) (VAFIN ist) (ADJD falsch))) ($. .)",1,0,0
Die Polizei hat 3 Bekenner-schreiben gefunden.,(S (NP (ART Die) (NN Polizei)) (VAFIN hat) (VP (NP (CARD 3) (NN Bekenner-schreiben)) (VVPP gefunden))) ($. .),1,0,0
Und sie hat einen Mann fest-genommen.,(S (KON Und) (PPER sie) (VAFIN hat) (VP (NP (ART einen) (NN Mann)) (VVPP fest-genommen))) ($. .),1,0,0
Der Mann heißt Sergej W.  \newline Er ist 28 Jahre alt.,(S (NP (ART Der) (NN Mann)) (VVFIN heißt) (PN (NE Sergej) (NE W.))) ($.  ),1,0,0
Er hat die Bomben gemacht.,(S (PPER Er) (VAFIN hat) (VP (NP (ART die) (NN Bomben)) (VVPP gemacht))) ($. .),1,0,0
Sergej W. hat den Anschlag aus Habgier gemacht.,(S (PN (NE Sergej) (NE W.)) (VAFIN hat) (VP (VP (NP (ART den) (NN Anschlag)) (PP (APPR aus) (NE Habgier)) (VVPP  )) (VVPP gemacht))) ($. .),1,0,0
Er wollte das die Aktien vom Fußball-verein Borussia Dortmund weniger Wert sind.,(S (PPER Er) (VMFIN wollte) (PDS das)),1,0,0
Er wollte damit viel Geld verdienen.,(S (PPER Er) (VMFIN wollte) (VP (PROAV damit) (NP (PIAT viel) (NN Geld)) (VVINF verdienen))) ($. .),1,0,0
Darum hat er vor dem Anschlag Options-schein gekauft.,(S (PROAV Darum) (VAFIN hat) (PPER er) (VP (PP (APPR vor) (ART dem) (NN Anschlag)) (NN Options-schein) (VVPP gekauft))) ($. .),1,0,0
Der Anschlag auf den Bus von Borussia Dortmund ist am 11. April 2017 passiert.,(S (NP (ART Der) (NN Anschlag) (PP (APPR auf) (ART den) (NN Bus) (PP (APPR von) (PN (NE Borussia) (NE Dortmund))))) (VAFIN ist) (VP (PP (APPRART am) (ADJA 11.) (NN April) (CARD 2017)) (VVPP passiert))) ($. .),1,1,2
Jemand hat auf er Straße Spreng-stoff versteckt.,(S (PIS Jemand) (VAFIN hat) (VP (PP (APPR auf) (PPOSAT er) (NN Straße)) (NN Spreng-stoff) (VVPP versteckt))) ($. .),1,0,0
"Als der Bus von Borussia Dortmund vorbei-gefahren ist, \newline ist der Spreng-stoff explodiert.","(KOUS Als) (NP (ART der) (NN Bus)) (VP (PP (APPR von) (PN (NE Borussia) (NE Dortmund))) (VVPP vorbei-gefahren)) (VAFIN ist) ($, ,) (S (ADV \newline) (VAFIN ist) (NP (ART der) (NN Spreng-stoff)) (VP (VVPP explodiert))) ($. .)",1,0,0
Ein Polizist und ein Fußball-spieler sind verletzt.,(S (CNP (NP (ART Ein) (NN Polizist)) (KON und) (NP (ART ein) (NN Fußball-spieler))) (VAFIN sind) (VVPP verletzt)) ($. .),1,0,0
Der Anschlag ist in Höchsten passiert.,(S (NP (ART Der) (NN Anschlag)) (VAFIN ist) (VP (PP (APPR in) (NN Höchsten)) (VVPP passiert))) ($. .),1,0,0
In Ankara gab es eine Demonstration.,(S (PP (APPR In) (NE Ankara)) (VVFIN gab) (PPER es) (NP (ART eine) (NN Demonstration))) ($. .),1,0,0
Die Menschen auf der Demonstration wollen das der Türkei-PKK-Konflikt aufhört.,(S (NP (ART Die) (NN Menschen) (PP (APPR auf) (ART der) (NN Demonstration))) (VMFIN wollen) (S (KOUS das) (NP (ART der) (NN Türkei-PKK-Konflikt)) (VVFIN aufhört))) ($. .),1,1,0
Es sind viele Menschen zur Demonstration gekommen.,(S (PPER Es) (VAFIN sind) (NP (PIAT viele) (NN Menschen)) (VP (PP (APPRART zur) (NN Demonstration)) (VVPP gekommen))) ($. .),1,0,0
Es gab eine große Menschen-menge.,(S (PPER Es) (VVFIN gab) (NP (ART eine) (ADJA große) (NN Menschen-menge))) ($. .),1,1,0
Dann hat jemand in der Menschen-menge eine Bombe gezündet.,(S (ADV Dann) (VAFIN hat) (NP (PIS jemand) (PP (APPR in) (ART der) (NN Menschen-menge))) (VP (NP (ART eine) (NN Bombe)) (VVPP gezündet))) ($. .),1,1,0
"Wer den Anschlag gemacht hat, \newline weiß man noch nicht.","(S (PWS Wer) (VP (NP (ART den) (NN Anschlag)) (VVPP gemacht)) (VAFIN hat)) ($, ,) (S (PDS \newline) (VVFIN weiß) (PIS man) (AVP (ADV noch) (PTKNEG nicht))) ($. .)",1,0,0
Manche sagen es war die IS Gruppe.,(S (PIS Manche) (VVFIN sagen) (S (PPER es) (VAFIN war) (NP (ART die) (NE IS) (NN Gruppe)))) ($. .),1,1,0
Manche sagen die Bomben waren ähnlich wie beim Anschlag in Suruc.,(S (PIS Manche) (VVFIN sagen) (S (NP (ART die) (NN Bomben)) (VAFIN waren) (AP (ADJD ähnlich) (PP (KOKOM wie) (APPRART beim) (NN Anschlag) (PP (APPR in) (NE Suruc)))))) ($. .),1,0,1
Die Menschen auf der Demo wollen das der Türkei-PKK-Konflikt aufhört.,(S (NP (ART Die) (NN Menschen) (PP (APPR auf) (ART der) (NN Demo))) (VMFIN wollen) (S (KOUS das) (NP (ART der) (NN Türkei-PKK-Konflikt)) (VVFIN aufhört))) ($. .),1,1,0
Der Anschlag in Ankara 2015 war am 10. Oktober 2015.  \newline Dabei sind 97 Menschen gestorben.,(NP (ART Der) (NN Anschlag) (PP (APPR in) (NE Ankara)) (CARD 2015)) (VAFIN war) (APPRART am) (ADJA 10.) (NN Oktober) ($. 2015.) ($.  ) (XY \newline),0,1,0
Und sehr viele Menschen sind verletzt worden.,(S (KON Und) (NP (AP (ADV sehr) (PIAT viele)) (NN Menschen)) (VAFIN sind) (VP (VVPP verletzt) (VAPP worden))) ($. .),1,1,0
Jemand hat 2 Bomben gezündet.,(S (PIS Jemand) (VAFIN hat) (VP (NP (CARD 2) (NN Bomben)) (VVPP gezündet))) ($. .),1,0,0
Das haben die Täter absichtlich gemacht.,(S (PDS Das) (VAFIN haben) (NP (ART die) (NN Täter)) (VP (ADJD absichtlich) (VVPP gemacht))) ($. .),1,0,0
Die Täter sind dabei selbst gestorben.,(S (NP (ART Die) (NN Täter)) (VAFIN sind) (PROAV dabei) (NP (ADV selbst)) (VP (VVPP gestorben))) ($. .),1,0,0
Der Anschlag war in der Stadt Ankara.,(S (NP (ART Der) (NN Anschlag)) (VAFIN war) (PP (APPR in) (ART der) (NN Stadt) (NE Ankara))) ($. .),1,0,1
Das ist in der Türkei.,(S (PDS Das) (VAFIN ist) (PP (APPR in) (ART der) (NE Türkei))) ($. .),1,0,0
Die Täter haben Bomben in ihrem Auto versteckt.,(S (NP (ART Die) (NN Täter)) (VAFIN haben) (VP (NN Bomben) (PP (APPR in) (PPOSAT ihrem) (NN Auto)) (VVPP versteckt))) ($. .),1,0,0
Dann sind sie mit dem Auto los-gefahren.,(S (ADV Dann) (VAFIN sind) (PPER sie) (PP (APPR mit) (ART dem) (NN Auto)) (VVPP los-gefahren)) ($. .),1,0,0
"Als sie an vielen Fahrzeugen vorbei-gefahren sind, \newline haben sie die Bombe gezündet.","(S (KOUS Als) (PPER sie) (VP (PP (APPR an) (PIAT vielen) (NN Fahrzeugen)) (VVPP vorbei-gefahren)) (VAFIN sind)) ($, ,) (S (ADV \newline) (VAFIN haben) (PPER sie) (VP (NP (ART die) (NN Bombe)) (VVPP gezündet))) ($. .)",1,0,0
In den anderen Fahrzeugen sind Soldaten gewesen.,(S (PP (APPR In) (ART den) (ADJA anderen) (NN Fahrzeugen)) (VAFIN sind) (NN Soldaten) (VP (VAPP gewesen))) ($. .),1,0,1
Es hat eine Explosion und viel Feuer gegeben.,(S (PPER Es) (VAFIN hat) (VP (CNP (NP (ART eine) (NN Explosion)) (KON und) (NP (PIAT viel) (NN Feuer))) (VVPP gegeben))) ($. .),1,0,0
"Wer den Anschlag gemacht hat, \newline weiß man noch nicht.","(S (PWS Wer) (VP (NP (ART den) (NN Anschlag)) (VVPP gemacht)) (VAFIN hat)) ($, ,) (S (PDS \newline) (VVFIN weiß) (PIS man) (AVP (ADV noch) (PTKNEG nicht))) ($. .)",1,0,0
Manche sagen es ist die IS Gruppe gewesen.,(S (PIS Manche) (VVFIN sagen) (S (PPER es) (VAFIN ist) (VP (NP (ART die) (NE IS)) (NN Gruppe) (VAPP gewesen)))) ($. .),1,0,0
Weil die Türkei im Krieg in Syrien mitmacht.,(S (KOUS Weil) (NP (ART die) (NE Türkei)) (PP (APPRART im) (NN Krieg) (PP (APPR in) (NE Syrien))) (VVFIN mitmacht)) ($. .),1,0,1
Manche sagen es ist die PKK Gruppe gewesen.,(S (PIS Manche) (VVFIN sagen) (S (PPER es) (VAFIN ist) (VP (NP (ART die) (NE PKK)) (NN Gruppe) (VAPP gewesen)))) ($. .),1,0,0
Weil die Türkei Streit mit der PKK hat.,(S (KOUS Weil) (NP (ART die) (NE Türkei)) (NP (NN Streit) (PP (APPR mit) (ART der) (NE PKK))) (VAFIN hat)) ($. .),1,1,0
"Angela Merkel hat gesagt, \newline dass der Anschlag böse und schrecklich gewesen ist.","(S (PN (NE Angela) (NE Merkel)) (VAFIN hat) (VP (VVPP gesagt))) ($, ,) (S (ADV \newline) (KOUS dass) (NP (ART der) (NN Anschlag)) (VP (CAP (ADJD böse) (KON und) (ADJD schrecklich)) (VAPP gewesen)) (VAFIN ist)) ($. .)",1,0,0
Sie denkt an die gestorbenen Menschen.,(S (PPER Sie) (VVFIN denkt) (PP (APPR an) (ART die) (ADJA gestorbenen) (NN Menschen))) ($. .),1,0,1
Und an die verletzten Menschen.,(S (KON Und) (PP (APPR an) (ART die) (ADJA verletzten) (NN Menschen))) ($. .),0,0,1
"Angela Merkel hat auch gesagt, \newline die Menschen die das gemacht haben müssen bestraft werden.","(S (PN (NE Angela) (NE Merkel)) (VAFIN hat) (VP (ADV auch) (VVPP gesagt))) ($, ,) (S (ADV \newline) (ART die) (NN Menschen) (S (S (PRELS die) (VP (VP (PDS das) (VVPP gemacht)) (VAFIN haben))) (VMFIN müssen) (VP (VVPP bestraft) (VAINF werden)))) ($. .)",1,0,0
Deutschland hilft der Türkei diese Menschen zu finden und zu bestrafen.,(S (NE Deutschland) (VVFIN hilft) (NP (ART der) (NE Türkei)) (CVP (VP (NP (PDAT diese) (NN Menschen)) (VZ (PTKZU zu) (VVINF finden))) (KON und) (VZ (PTKZU zu) (VVINF bestrafen)))) ($. .),1,0,0
In der Türkei hat es schon viele Anschläge gegeben.,(S (PP (APPR In) (ART der) (NE Türkei)) (VAFIN hat) (PPER es) (VP (ADV schon) (NP (PIAT viele) (NN Anschläge)) (VVPP gegeben))) ($. .),1,0,0
Der letzte ist am 12. Januar 2016 gewesen.,(S (NP (ART Der) (ADJA letzte)) (VAFIN ist) (VP (PP (APPRART am) (ADJA 12.) (NN Januar) (CARD 2016)) (VAPP gewesen))) ($. .),1,0,1
Der Anschlag in Ankara 2016 ist am 17. Februar 2016 gewesen.,(S (NP (ART Der) (NN Anschlag) (PP (APPR in) (NE Ankara)) (CARD 2016)) (VAFIN ist) (VP (PP (APPRART am) (ADJA 17.) (NN Februar) (CARD 2016)) (VAPP gewesen))) ($. .),1,1,1
Dabei sind 26 Menschen gestorben.,(S (PROAV Dabei) (VAFIN sind) (NP (CARD 26) (NN Menschen)) (VP (VVPP gestorben))) ($. .),1,0,0
Und viele Menschen sind verletzt worden.,(S (KON Und) (NP (PIAT viele) (NN Menschen)) (VAFIN sind) (VP (VVPP verletzt) (VAPP worden))) ($. .),1,0,0
Jemand hat ein Auto in die Luft gesprengt.,(S (PIS Jemand) (VAFIN hat) (VP (NP (ART ein) (NN Auto)) (PP (APPR in) (ART die) (NN Luft)) (VVPP gesprengt))) ($. .),1,0,0
Das haben die Täter absichtlich gemacht.,(S (PDS Das) (VAFIN haben) (NP (ART die) (NN Täter)) (VP (ADJD absichtlich) (VVPP gemacht))) ($. .),1,0,0
Sie haben viele Menschen töten und verletzen wollen.,(S (PPER Sie) (VAFIN haben) (VP (CVP (VP (NP (PIAT viele) (NN Menschen)) (VVINF töten)) (KON und) (VP (VVINF verletzen))) (VMINF wollen))) ($. .),1,0,0
Die Täter sind dabei selbst gestorben.,(S (NP (ART Die) (NN Täter)) (VAFIN sind) (PROAV dabei) (NP (ADV selbst)) (VP (VVPP gestorben))) ($. .),1,0,0
Der Anschlag ist in der Stadt Ankara gewesen.,(S (NP (ART Der) (NN Anschlag)) (VAFIN ist) (VP (PP (APPR in) (ART der) (NN Stadt) (NE Ankara)) (VAPP gewesen))) ($. .),1,0,1
Das ist in der Türkei.,(S (PDS Das) (VAFIN ist) (PP (APPR in) (ART der) (NE Türkei))) ($. .),1,0,0
Die Bombe explodierte um 18:56 Uhr.,(S (NP (ART Die) (NN Bombe)) (VVFIN explodierte) (PP (APPR um) (CARD 18:56) (NN Uhr))) ($. .),1,0,0
"Wer die Bombe gezündet hat, \newline weiß man nicht.","(S (PWS Wer) (VP (NP (ART die) (NN Bombe)) (VVPP gezündet)) (VAFIN hat)) ($, ,) (S (PDS \newline) (VVFIN weiß) (PIS man) (PTKNEG nicht)) ($. .)",1,0,0
Bis jetzt hat sich niemand dazu bekannt.,(S (PP (APPR Bis) (ADV jetzt)) (VAFIN hat) (PRF sich) (PIS niemand) (VP (PROAV dazu) (VVPP bekannt))) ($. .),1,0,0
Viele glauben das es wegen politischer Meinungen gemacht worden ist.,(S (PIS Viele) (VVFIN glauben) (S (KOUS das) (PPER es) (VP (VP (PP (APPR wegen) (ADJA politischer) (NN Meinungen)) (VVPP gemacht)) (VAPP worden)) (VAFIN ist))) ($. .),1,0,0
Und weil anderen Menschen Angst gemacht werden soll.,(S (KON Und) (S (KOUS weil) (NP (ADJA anderen) (NN Menschen)) (NN Angst) (VP (VP (VVPP gemacht)) (VAINF werden)) (VMFIN soll))) ($. .),1,0,0
Damit sie nicht mehr in Thailand Urlaub machen.,(S (KOUS Damit) (PPER sie) (AVP (PTKNEG nicht) (ADV mehr)) (PP (APPR in) (NE Thailand)) (NN Urlaub) (VVFIN machen)) ($. .),1,0,0
Die Bombe explodierte zwischen vielen Menschen.,(S (NP (ART Die) (NN Bombe)) (VVFIN explodierte) (PP (APPR zwischen) (PIAT vielen) (NN Menschen))) ($. .),1,0,0
Es waren sehr viele Urlauber an dem Ort.,(S (PPER Es) (VAFIN waren) (NP (AP (ADV sehr) (PIAT viele)) (NN Urlauber)) (PP (APPR an) (ART dem) (NN Ort))) ($. .),1,1,0
Sie waren gerade im Ratchaprasong-viertel einkaufen.,(S (PPER Sie) (VAFIN waren) (VP (ADV gerade) (PP (APPRART im) (NN Ratchaprasong-viertel)) (VVINF einkaufen))) ($. .),1,0,0
