sentence,tree,is_sent,big_np_count,big_pp_count
Eine sehr bekannte Alchemisten war Maria die Jüdin.,(S (NP (ART Eine) (AP (ADV sehr) (ADJA bekannte)) (NN Alchemisten)) (VAFIN war) (PN (NE Maria) (NP (ART die) (NN Jüdin)))) ($. .),1,1,0
Alchemisten wollen etwas ver-bessern.,(S (NN Alchemisten) (VMFIN wollen) (VP (PIS etwas) (VVINF ver-bessern))) ($. .),1,0,0
"Zum Beispiel, \newline wollen sie kranke Menschen gesund machen.","(PP (APPRART Zum) (NN Beispiel)) ($, ,) (S (ADV \newline) (VMFIN wollen) (PPER sie) (VP (NP (ADJA kranke) (NN Menschen)) (ADJD gesund) (VVINF machen))) ($. .)",1,0,0
Alchemisten haben Athanoren benutzt.,(S (NN Alchemisten) (VAFIN haben) (VP (NN Athanoren) (VVPP benutzt))) ($. .),1,0,0
Sue haben Schwarz-pulver erfunden.,(S (NE Sue) (VAFIN haben) (VP (NN Schwarz-pulver) (VVPP erfunden))) ($. .),1,0,0
Und sie haben Porzellan erfunden.,(S (KON Und) (PPER sie) (VAFIN haben) (VP (NN Porzellan) (VVPP erfunden))) ($. .),1,0,0
Alchemie ist ein arabisches Wort.,(S (NN Alchemie) (VAFIN ist) (NP (ART ein) (ADJA arabisches) (NN Wort))) ($. .),1,1,0
Alchemie ist Chemie.,(S (NN Alchemie) (VAFIN ist) (NN Chemie)) ($. .),1,0,0
Es werden Versuche und Experimente gemacht.,(S (NP (PPER Es)) (VAFIN werden) (CNP (NN Versuche) (KON und) (NN Experimente)) (VVPP gemacht)) ($. .),1,0,0
Damit man versteht wie etwas funktioniert.,(S (KOUS Damit) (PIS man) (VVFIN versteht) (S (PWAV wie) (PIS etwas) (VVFIN funktioniert))) ($. .),1,0,0
Durch Alchemie entdeckt man neue Sachen.,(S (PP (APPR Durch) (NN Alchemie)) (VVFIN entdeckt) (PIS man) (NP (ADJA neue) (NN Sachen))) ($. .),1,0,0
Zum Beispiel wie man Porzellan macht.,(S (PP (APPRART Zum) (NN Beispiel)) (PWAV wie) (PIS man) (NN Porzellan) (VVFIN macht)) ($. .),1,0,0
Oder wie man Gold macht.,(S (KON Oder) (PWAV wie) (PIS man) (NN Gold) (VVFIN macht)) ($. .),1,0,0
Alkopops schmecken ähnlich wie Cola.,(S (NN Alkopops) (VVFIN schmecken) (AP (ADJD ähnlich) (NP (KOKOM wie) (NN Cola)))) ($. .),1,0,0
Den Alkohol schmeckt man fast nicht.,(S (NP (ART Den) (NN Alkohol)) (VVFIN schmeckt) (PIS man) (AVP (ADV fast) (PTKNEG nicht))) ($. .),1,0,0
Meistens werden Alkopos in bunten Flaschen verkauft.,(S (ADV Meistens) (VAFIN werden) (NN Alkopos) (VP (PP (APPR in) (ADJA bunten) (NN Flaschen)) (VVPP verkauft))) ($. .),1,0,0
Alcopop ist ein süßes Getränk.,(S (NN Alcopop) (VAFIN ist) (NP (ART ein) (ADJA süßes) (NN Getränk))) ($. .),1,1,0
In diesem Getränk ist Alkohol.,(S (PP (APPR In) (PDAT diesem) (NN Getränk)) (VAFIN ist) (NN Alkohol)) ($. .),1,0,0
Aldous Huxley kommt am 26. Juli 1894 auf die Welt.,(S (PN (NE Aldous) (NE Huxley)) (VVFIN kommt) (PP (APPRART am) (ADJA 26.) (NN Juli) (CARD 1894)) (PP (APPR auf) (ART die) (NN Welt))) ($. .),1,0,1
"In Godalming, Surrey.","(APPR In) (NE Godalming) ($, ,) (PP (NE Surrey)) ($. .)",0,0,0
"Er stirbt am 22. November 1963. \newline In Los Angeles, USA. \newline  \newline Im Jahr 1932: \newline Huxley schreibt seinen berühmtesten Roman.",(PPER Er) (VVFIN stirbt) (APPRART am) (ADJA 22.) (NN November) ($. 1963.),0,0,0
Den Science-fiction: \newline Schöne neue Welt \newline Es ist eine Dystopie.,(NP (ART Den) (NN Science-fiction)) ($. :) (NE \newline),0,0,0
Aldous Huxley war ein Schrift-steller.,(S (PN (NE Aldous) (NE Huxley)) (VAFIN war) (NP (ART ein) (NN Schrift-steller))) ($. .),1,0,0
Aleppo ist eine sehr alte Stadt.,(S (NE Aleppo) (VAFIN ist) (NP (ART eine) (AP (ADV sehr) (ADJA alte)) (NN Stadt))) ($. .),1,1,0
Menschen haben hier schon 3 Tausend Jahre vor Christus gelebt.,(S (NN Menschen) (VAFIN haben) (VP (ADV hier) (NP (ADV schon) (CARD 3) (NN Tausend) (NN Jahre) (PP (APPR vor) (NN Christus))) (VVPP gelebt))) ($. .),1,1,0
"Im Jahr 2008 haben ungefähr 1,7 Millionen Menschen in Aleppo gewohnt.","(S (PP (APPRART Im) (NN Jahr) (CARD 2008)) (VAFIN haben) (NP (AP (ADJD ungefähr) (NM (CARD 1,7) (NN Millionen))) (NN Menschen)) (VP (PP (APPR in) (NE Aleppo)) (VVPP gewohnt))) ($. .)",1,1,0
Die meisten Menschen in Aleppo sind Araber und Kurden.,(S (NP (ART Die) (PIAT meisten) (NN Menschen) (PP (APPR in) (NE Aleppo))) (VAFIN sind) (CNP (NN Araber) (KON und) (NN Kurden))) ($. .),1,1,0
Das heißt: \newline Die meisten Menschen in Aleppo sind Muslime.,(S (PDS Das) (VVFIN heißt)) ($. :) (NE \newline),1,0,0
In Aleppo gibt es auch Christ.,(S (PP (APPR In) (NE Aleppo)) (VVFIN gibt) (PPER es) (ADV auch) (NN Christ)) ($. .),1,0,0
Ungefähr 15 Prozent der Menschen in Aleppo sind Christen.,(S (NP (AP (ADV Ungefähr) (CARD 15)) (NN Prozent) (NP (ART der) (NN Menschen) (PP (APPR in) (NE Aleppo)))) (VAFIN sind) (NN Christen)) ($. .),1,2,0
Im Jahr 1952 hat ein Architekt neue Straßen geplant.,(S (PP (APPRART Im) (NN Jahr) (CARD 1952)) (VAFIN hat) (NP (ART ein) (NN Architekt)) (VP (NP (ADJA neue) (NN Straßen)) (VVPP geplant))) ($. .),1,0,0
Moderne und breite Straßen.,(CNP (NN Moderne) (KON und) (NP (ADJA breite) (NN Straßen))) ($. .),0,0,0
Ab dem Jahr 1970 waren Bau-arbeiter in der Alt-stadt.,(S (PP (APPR Ab) (ART dem) (NN Jahr) (CARD 1970)) (VAFIN waren) (NN Bau-arbeiter) (PP (APPR in) (ART der) (NN Alt-stadt))) ($. .),1,0,1
Sie haben viele alte Häuser abgerissen.,(S (PPER Sie) (VAFIN haben) (VP (NP (PIAT viele) (ADJA alte) (NN Häuser)) (VVPP abgerissen))) ($. .),1,1,0
"Und neue, moderne Wohn-blöcke gebaut.","(KON Und) (CAP (ADJA neue)) ($, ,) (VP (NP (ADJA moderne) (NN Wohn-blöcke)) (VVPP gebaut)) ($. .)",0,0,0
Im Jahr 1986 hat die UNESCO gesagt: \newline Die Alt-stadt von Aleppo ist jetzt Welt-kultur-erbe.,(S (PP (APPRART Im) (NN Jahr) (CARD 1986)) (VAFIN hat) (NP (ART die) (NE UNESCO)) (VP (VVPP gesagt))) ($. :) (FM \newline),1,0,0
In Syrien ist Bürger-krieg.,(S (PP (APPR In) (NE Syrien)) (VAFIN ist) (NN Bürger-krieg)) ($. .),1,0,0
Viele Stadt-teile sind kaputt.,(S (NP (PIAT Viele) (NN Stadt-teile)) (VAFIN sind) (ADJD kaputt)) ($. .),1,0,0
Viele Bewohner sind geflüchtet.,(S (NP (PIAT Viele) (NN Bewohner)) (VAFIN sind) (VVPP geflüchtet)) ($. .),1,0,0
Aleppo ist eine Stadt in Syrien.,(S (NE Aleppo) (VAFIN ist) (NP (ART eine) (NN Stadt) (PP (APPR in) (NE Syrien)))) ($. .),1,1,0
Aleppo ist die zweit-größte Stadt in Syrien.,(S (NE Aleppo) (VAFIN ist) (NP (ART die) (ADJA zweit-größte) (NN Stadt) (PP (APPR in) (NE Syrien)))) ($. .),1,1,0
Die größte Stadt in Syrien ist Damaskus.,(S (NP (ART Die) (ADJA größte) (NN Stadt) (PP (APPR in) (NE Syrien))) (VAFIN ist) (NE Damaskus)) ($. .),1,1,0
Der Mann Ali ibn Abi Talib ist den Aleviten sehr wichtig.,(S (NP (ART Der) (NN Mann) (PN (NE Ali) (NE ibn) (NE Abi) (NE Talib))) (VAFIN ist) (NP (ART den) (NN Aleviten)) (AP (ADV sehr) (ADJD wichtig))) ($. .),1,1,0
Dieser Mann ist der Schwieger-sohn von Mohammed.,(NP (PDAT Dieser) (NN Mann)) (VAFIN ist) (ART der) (NN Schwieger-sohn) (PP (APPR von) (NE Mohammed)) ($. .),0,0,0
Die Religion der Aleviten ist etwas anders als die der meisten Muslime.,(S (NP (ART Die) (NN Religion) (NP (ART der) (NN Aleviten))) (VAFIN ist) (AVP (ADV etwas) (ADV anders) (NP (KOKOM als) (PDS die) (NP (ART der) (PIAT meisten) (NN Muslime))))) ($. .),1,3,0
Zum Beispiel tragen die meisten alevitischen Frauen kein Kopftuch.,(S (PP (APPRART Zum) (NN Beispiel)) (VVFIN tragen) (NP (ART die) (PIAT meisten) (ADJA alevitischen) (NN Frauen)) (NP (PIAT kein) (NN Kopftuch))) ($. .),1,1,0
Ungefähr ein Drittel der Menschen in der Türkei sind Aleviten.,(S (NP (ADV Ungefähr) (ART ein) (NN Drittel) (NP (ART der) (NN Menschen) (PP (APPR in) (ART der) (NE Türkei)))) (VAFIN sind) (NN Aleviten)) ($. .),1,2,0
Die Aleviten sind eine Religions-gemeinschaft.,(S (NP (ART Die) (NN Aleviten)) (VAFIN sind) (NP (ART eine) (NN Religions-gemeinschaft))) ($. .),1,0,0
Eine Religions-gemeinschaft sind mehrere Menschen.,(S (NP (ART Eine) (NN Religions-gemeinschaft)) (VAFIN sind) (NP (PIAT mehrere) (NN Menschen))) ($. .),1,0,0
Sie haben eine bestimmte Religion.,(S (PPER Sie) (VAFIN haben) (NP (ART eine) (ADJA bestimmte) (NN Religion))) ($. .),1,1,0
Die Religions-gemeinschaft der Aleviten kommt aus der Türkei.,(S (NP (ART Die) (NN Religions-gemeinschaft) (NP (ART der) (NN Aleviten))) (VVFIN kommt) (PP (APPR aus) (ART der) (NE Türkei))) ($. .),1,1,0
Einige Aleviten sehen sich als Muslime.,(S (NP (PIAT Einige) (NN Aleviten)) (VVFIN sehen) (PRF sich) (PP (APPR als) (NN Muslime))) ($. .),1,0,0
Andere Aleviten sehen sich nicht als Muslime.,(S (NP (ADJA Andere) (NN Aleviten)) (VVFIN sehen) (PRF sich) (PTKNEG nicht) (PP (APPR als) (NN Muslime))) ($. .),1,0,0
Er ist auf einen sehr großen Berg geklettert.,(S (PPER Er) (VAFIN ist) (VP (PP (APPR auf) (ART einen) (AP (ADV sehr) (ADJA großen)) (NN Berg)) (VVPP geklettert))) ($. .),1,0,1
Der Berg heißt: El Capitan.,(S (NP (ART Der) (NN Berg)) (VVFIN heißt)) ($. :) (PN (NE El) (NE Capitan)) ($. .),1,0,0
Die Kletter-route ist fast 1000 Meter lang.,(S (NP (ART Die) (NN Kletter-route)) (VAFIN ist) (AP (NP (AP (ADV fast) (CARD 1000)) (NN Meter)) (ADJD lang))) ($. .),1,1,0
Über Alex Honnold gibt es einen Film.,(S (PP (APPR Über) (PN (NE Alex) (NE Honnold))) (VVFIN gibt) (PPER es) (NP (ART einen) (NN Film))) ($. .),1,0,0
Er heißt: Free Solo.,(S (PPER Er) (VVFIN heißt)) ($. :) (PN (FM Free) (FM Solo)) ($. .),1,0,0
Alex Honnold ist ein bekannter Free Solo Kletterer.,(S (PN (NE Alex) (NE Honnold)) (VAFIN ist) (NP (ART ein) (ADJA bekannter) (FM Free) (FM Solo) (NN Kletterer))) ($. .),1,1,0
Er ist am 17. August 1985 geboren.,(S (PPER Er) (VAFIN ist) (VP (PP (APPRART am) (ADJA 17.) (NN August) (CARD 1985)) (VVPP geboren))) ($. .),1,0,1
In den USA.,(PP (APPR In) (ART den) (NE USA)) ($. .),0,0,0
Alexander Graham Bell kommt am 3. März 1847 auf die Welt.,(S (PN (NE Alexander) (NE Graham) (NE Bell)) (VVFIN kommt) (PP (APPRART am) (ADJA 3.) (NN März) (CARD 1847)) (PP (APPR auf) (ART die) (NN Welt))) ($. .),1,0,1
"In Edinburgh, Schottland.","(APPR In) (NE Edinburgh) ($, ,) (PP (NE Schottland)) ($. .)",0,0,0
"Er stirbt am 2. August 1922. \newline In Baddeck, Kanada.",(PPER Er) (VVFIN stirbt) (APPRART am) (ADJA 2.) (NN August) ($. 1922.),0,0,0
Der Groß-vater von Alexander Graham Bell hat sich mit Sprech-technik beschäftigt.,(S (NP (ART Der) (NN Groß-vater) (PP (APPR von) (PN (NE Alexander) (NE Graham) (NE Bell)))) (VAFIN hat) (VP (PRF sich) (PP (APPR mit) (NN Sprech-technik)) (VVPP beschäftigt))) ($. .),1,1,1
Der Vater von Bell heißt Alexander Melville Bell.,(S (NP (ART Der) (NN Vater) (PP (APPR von) (NE Bell))) (VVFIN heißt) (PN (NE Alexander) (NE Melville) (NE Bell))) ($. .),1,1,0
Der Vater von Bell war Professor für Rede-kunst und Vortrags-kunst.,(S (NP (ART Der) (NN Vater) (PP (APPR von) (NE Bell))) (VAFIN war) (NP (NN Professor) (PP (APPR für) (CNP (NN Rede-kunst) (KON und) (NN Vortrags-kunst))))) ($. .),1,2,1
Der Vater hat eine Laut-schrift erfunden.,(S (NP (ART Der) (NN Vater)) (VAFIN hat) (VP (NP (ART eine) (NN Laut-schrift)) (VVPP erfunden))) ($. .),1,0,0
Die Laut-schrift heißt Visible Speech.,(S (NP (ART Die) (NN Laut-schrift)) (VVFIN heißt) (CH (FM Visible) (FM Speech))) ($. .),1,0,0
Die Mutter von Bell heißt Eliza Symonds Bell.,(S (NP (ART Die) (NN Mutter) (PP (APPR von) (NE Bell))) (VVFIN heißt) (PN (NE Eliza) (NE Symonds) (NE Bell))) ($. .),1,1,0
Die Mutter war stark schwerhörig.,(S (NP (ART Die) (NN Mutter)) (VAFIN war) (AP (ADJD stark) (ADJD schwerhörig))) ($. .),1,0,0
Bell hat mit ihr mit einer tiefen Stimme gesprochen.,(S (NE Bell) (VAFIN hat) (VP (PP (APPR mit) (PPER ihr)) (PP (APPR mit) (ART einer) (ADJA tiefen) (NN Stimme)) (VVPP gesprochen))) ($. .),1,0,1
Dann konnte sie ihn besser hören.,(S (ADV Dann) (VMFIN konnte) (PPER sie) (VP (PPER ihn) (ADJD besser) (VVINF hören))) ($. .),1,0,0
Bell studiert in Edinburgh.,(S (NE Bell) (VVFIN studiert) (PP (APPR in) (NE Edinburgh))) ($. .),1,0,0
Er studiert die Fächer Latein und Griechisch.,(S (PPER Er) (VVFIN studiert) (NP (ART die) (NN Fächer) (CNP (NN Latein) (KON und) (NN Griechisch)))) ($. .),1,1,0
Mit 17 Jahren wird Bell Lehrer.,(S (PP (APPR Mit) (CARD 17) (NN Jahren)) (VAFIN wird) (NE Bell) (NN Lehrer)) ($. .),1,0,0
An der einer Schule für Sprech-technik und Musik.,(PP (APPR An) (PDS der) (NP (ART einer) (NN Schule) (PP (APPR für) (CNP (NN Sprech-technik) (KON und) (NN Musik))))) ($. .),0,1,2
In seiner Freizeit forscht er.,(S (PP (APPR In) (PPOSAT seiner) (NN Freizeit)) (VVFIN forscht) (PPER er)) ($. .),1,0,0
Er forscht zum Thema Akustik.,(S (PPER Er) (VVFIN forscht) (PP (APPRART zum) (NN Thema) (NN Akustik))) ($. .),1,0,0
Sein Vater unterrichtet in einer Universität in London.,(S (NP (PPOSAT Sein) (NN Vater)) (VVFIN unterrichtet) (PP (APPR in) (ART einer) (NN Universität) (PP (APPR in) (NE London)))) ($. .),1,0,1
Dort ist er Dozent für Sprach-technik.,(S (ADV Dort) (VAFIN ist) (PPER er) (NP (NN Dozent) (PP (APPR für) (NN Sprach-technik)))) ($. .),1,1,0
Er stellt seinen Sohn als Assistenten ein.,(S (PPER Er) (VVFIN stellt) (NP (PPOSAT seinen) (NN Sohn)) (PP (APPR als) (NN Assistenten)) (PTKVZ ein)) ($. .),1,0,0
Seit dem Jahr 1868 gibt Alexander Graham Bell Sprech-unterricht.,(S (PP (APPR Seit) (ART dem) (NN Jahr) (CARD 1868)) (VVFIN gibt) (PN (NE Alexander) (NE Graham) (NE Bell)) (NN Sprech-unterricht)) ($. .),1,0,1
Für gehörlose Kinder.,(PP (APPR Für) (ADJA gehörlose) (NN Kinder)) ($. .),0,0,0
Alexander Graham Bell studiert bist zum Jahr 1870. \newline Er studiert alles über die menschlichen Stimme.,(S (PN (NE Alexander) (NE Graham) (NE Bell)) (VP (VVPP studiert)) (VAFIN bist) (APPRART zum) (NN Jahr)) ($. 1870.),1,0,0
Im Jahr 1870 zieht die Familie Bell nach Kanada.,(S (PP (APPRART Im) (NN Jahr) (CARD 1870)) (VVFIN zieht) (NP (ART die) (NN Familie) (NE Bell)) (PP (APPR nach) (NE Kanada))) ($. .),1,1,0
Im Jahr 1871 wird Bell Gehörlosenlehrer.,(S (PP (APPRART Im) (NN Jahr) (CARD 1871)) (VAFIN wird) (NE Bell) (NN Gehörlosenlehrer)) ($. .),1,0,0
"An der Clarke School in Northampton, Massachusetts.","(APPR An) (ART der) (PN (NE Clarke) (NE School)) (APPR in) (NE Northampton) ($, ,) (PP (PP (NE Massachusetts))) ($. .)",0,0,0
Vom Jahr 1873 bis zum Jahr 1877 ist Bell Professor.,(S (PP (APPRART Vom) (NN Jahr) (CARD 1873)) (PP (APPR bis) (APPRART zum) (NN Jahr) (CARD 1877)) (VAFIN ist) (NE Bell) (NN Professor)) ($. .),1,0,1
Er ist Professor für Sprech-technik und Physiologie der Stimme.,(S (PPER Er) (VAFIN ist) (NP (NN Professor) (PP (APPR für) (CNP (NN Sprech-technik) (KON und) (NP (NN Physiologie) (NP (ART der) (NN Stimme))))))) ($. .),1,2,1
An der Universität Boston.,(PP (APPR An) (ART der) (NN Universität) (NE Boston)) ($. .),0,0,1
Sie haben sich an der Clarke School kennen gelernt.,(S (PPER Sie) (VAFIN haben) (VP (VP (PRF sich) (PP (APPR an) (ART der) (PN (NE Clarke) (NE School))) (VVINF kennen)) (VVPP gelernt))) ($. .),1,0,1
Alexander Graham Bell ist einer der Erfinder vom Telefon.,(S (PN (NE Alexander) (NE Graham) (NE Bell)) (VAFIN ist) (NP (PIS einer) (NP (ART der) (NN Erfinder) (PP (APPRART vom) (NN Telefon))))) ($. .),1,2,0
Alexander Graham Bell war ein Sprach-lehrer für Gehörlose.,(S (PN (NE Alexander) (NE Graham) (NE Bell)) (VAFIN war) (NP (ART ein) (NN Sprach-lehrer) (PP (APPR für) (NN Gehörlose)))) ($. .),1,1,0
Alexander Mitscherlich kommt am 20. September 1908 auf die Welt.,(S (PN (NE Alexander) (NE Mitscherlich)) (VVFIN kommt) (PP (APPRART am) (ADJA 20.) (NN September) (CARD 1908)) (PP (APPR auf) (ART die) (NN Welt))) ($. .),1,0,1
"In München, Deutschland.","(APPR In) (NE München) ($, ,) (PP (NE Deutschland)) ($. .)",0,0,0
"Er stirbt am 26. Juni 1982. \newline In Frankfurt am Main, Deutschland.",(PPER Er) (VVFIN stirbt) (APPRART am) (ADJA 26.) (NN Juni) ($. 1982.),0,0,0
Alexander Mitscherlich war ein: • Arzt,(S (PN (NE Alexander) (NE Mitscherlich)) (VAFIN war) (ART ein)) ($. :) (XY •) (NP (NN Arzt)),1,0,0
Alexander Mitscherlich war ein: • Psychoanalytiker,(S (PN (NE Alexander) (NE Mitscherlich)) (VAFIN war) (ART ein)) ($. :) ($LRB •) (NP (NN Psychoanalytiker)),1,0,0
Alexander Mitscherlich war ein: • Hochschul-lehrer,(S (PN (NE Alexander) (NE Mitscherlich)) (VAFIN war) (ART ein)) ($. :) ($LRB •) (NP (NN Hochschul-lehrer)),1,0,0
Alexander Mitscherlich war ein: • Schriftsteller,(S (PN (NE Alexander) (NE Mitscherlich)) (VAFIN war) (ART ein)) ($. :) (XY •) (NP (NN Schriftsteller)),1,0,0
Sein bekanntestes Buch heißt:,(S (NP (PPOSAT Sein) (ADJA bekanntestes) (NN Buch)) (VVFIN heißt)) ($. :),1,1,0
Die Unfähigkeit zu trauern,(NP (ART Die) (NN Unfähigkeit) (VZ (PTKZU zu) (VVINF trauern))),0,1,0
Das Buch hat er zusammen mit seiner Frau Margarete Mitscherlich geschrieben.,(S (NP (ART Das) (NN Buch)) (VAFIN hat) (PPER er) (VP (PP (ADV zusammen) (APPR mit) (PPOSAT seiner) (NN Frau) (PN (NE Margarete) (NE Mitscherlich))) (VVPP geschrieben))) ($. .),1,0,1
Alexander Sergejewitsch Puschkin kommt am 6. Juni 1799 auf die Welt.,(S (PN (NE Alexander) (NE Sergejewitsch) (NE Puschkin)) (VVFIN kommt) (PP (APPRART am) (ADJA 6.) (NN Juni) (CARD 1799)) (PP (APPR auf) (ART die) (NN Welt))) ($. .),1,0,1
"In Moskau, Russland.","(APPR In) (NE Moskau) ($, ,) (PP (NE Russland)) ($. .)",0,0,0
"Er stirbt am  10. Februar 1837. \newline In Sankt Petersburg, Russland.",(S (PPER Er) (VVFIN stirbt) (PTKA am)),1,0,0
Alexander Sergejewitsch Puschkin ist ein: \newline Schrift-steller \newline Dichter,(S (PN (NE Alexander) (NE Sergejewitsch) (NE Puschkin)) (VAFIN ist) (ART ein)) ($. :) (NE \newline),1,0,0
Alexander Sutherland Neill  kommt am 17. Oktober 1883 auf die Welt.,(S (PN (NE Alexander) (NE Sutherland) (NE Neill)) (VVFIN  ) (VVFIN kommt) (PP (APPRART am) (ADJA 17.) (NN Oktober) (CARD 1883)) (PP (APPR auf) (ART die) (NN Welt))) ($. .),1,0,1
"In Forfar, Schottland.","(APPR In) (NE Forfar) ($, ,) (PP (NE Schottland)) ($. .)",0,0,0
"Er stirbt am 23. September 1973. \newline In Aldeburgh, Suffolk, England.",(PPER Er) (VVFIN stirbt) (APPRART am) (ADJA 23.) (NN September) ($. 1973.),0,0,0
Alexander Sutherland Neill war ein Pädagoge.,(S (PN (NE Alexander) (NE Sutherland) (NE Neill)) (VAFIN war) (NP (ART ein) (NN Pädagoge))) ($. .),1,0,0
Er hat die Summerhill Schule geründet.,(S (PPER Er) (VAFIN hat) (VP (NP (ART die) (NE Summerhill) (NN Schule)) (VVPP geründet))) ($. .),1,1,0
Im Jahr 2012 hat er eine neue Richtung der Kunst erfunden.,(S (PP (APPRART Im) (NN Jahr) (CARD 2012)) (VAFIN hat) (PPER er) (VP (NP (ART eine) (ADJA neue) (NN Richtung) (NP (ART der) (NN Kunst))) (VVPP erfunden))) ($. .),1,1,0
Diese Kunst ist bei vielen Menschen beliebt.,(S (NP (PDAT Diese) (NN Kunst)) (VAFIN ist) (PP (APPR bei) (PIAT vielen) (NN Menschen)) (ADJD beliebt)) ($. .),1,0,0
Er ist ein Künstler aus Russland.,(S (PPER Er) (VAFIN ist) (NP (ART ein) (NN Künstler) (PP (APPR aus) (NE Russland)))) ($. .),1,1,0
Ein Algo-rithmus löst eine Aufgabe Schritt für Schritt.,(S (NP (ART Ein) (NN Algo-rithmus)) (VVFIN löst) (NP (ART eine) (NN Aufgabe)) (NP (NN Schritt) (PP (APPR für) (NN Schritt)))) ($. .),1,1,0
Das Gegenteil von einem Algorithmus ist eine Heuristik.,(S (NP (ART Das) (NN Gegenteil) (PP (APPR von) (ART einem) (NN Algorithmus))) (VAFIN ist) (NP (ART eine) (NN Heuristik))) ($. .),1,1,0
Ein Algorithmus ist eine Reihen-folge.,(S (NP (ART Ein) (NN Algorithmus)) (VAFIN ist) (NP (ART eine) (NN Reihen-folge))) ($. .),1,0,0
Mit einem Algo-rithmus kann man Probleme lösen.,(S (PP (APPR Mit) (ART einem) (NN Algo-rithmus)) (VMFIN kann) (PIS man) (VP (NN Probleme) (VVINF lösen))) ($. .),1,0,0
"In Piotrków Trybunalski, Polen.","(APPR In) (PN (NE Piotrków) (NE Trybunalski)) ($, ,) (PP (NE Polen)) ($. .)",0,0,0
"Sie stirbt am 14. April 2010. \newline In Saint-Rémy-de-Provence, Provence-Alpes-Côte d'Azur, Frankreich.",(PPER Sie) (VVFIN stirbt) (APPRART am) (ADJA 14.) (NN April) ($. 2010.),0,0,0
Millers Bücher kann man leichter verstehen.,(S (NP (NE Millers) (NN Bücher)) (VMFIN kann) (PIS man) (ADJD leichter) (VP (VVINF verstehen))) ($. .),1,0,0
Sie beschreibt Kind-Eltern-Beziehung.,(S (PPER Sie) (VVFIN beschreibt) (NN Kind-Eltern-Beziehung)) ($. .),1,0,0
Und kritisiert die Psychoanalyse.,(S (KON Und) (VVFIN kritisiert) (NP (ART die) (NN Psychoanalyse))) ($. .),1,0,0
Weil sie die Triebtheorie für eine Illusion hält.,(S (KOUS Weil) (PPER sie) (NP (ART die) (NN Triebtheorie)) (PP (APPR für) (ART eine) (NN Illusion)) (VVFIN hält)) ($. .),1,0,0
Miller sagt: \newline  \newline Die Triebtheorie ist falsch.,(S (NE Miller) (VVFIN sagt)) ($. :) (FM \newline) (XY  ) (FM \newline),1,0,0
Ein Kindheits-trauma ist mehr als kindliche Fantasie.,(S (NP (ART Ein) (NN Kindheits-trauma)) (VAFIN ist) (NP (PIS mehr) (NP (KOKOM als) (ADJA kindliche) (NN Fantasie)))) ($. .),1,2,0
"Wenn Menschen an die Triebtheorie glauben, \newline dann sehen sie nicht: \newline Kindes-missbrauch \newline Kindes-misshandlung \newline Das gibt es wirklich!","(AVP (S (KOUS Wenn) (NN Menschen) (PP (APPR an) (ART die) (NN Triebtheorie)) (VVFIN glauben))) ($, ,) (S (FM \newline) (S (ADV dann) (VVFIN sehen) (PPER sie) (PTKNEG nicht))) ($. :)",1,0,0
Alice Miller ist eine Psychologin.,(S (PN (NE Alice) (NE Miller)) (VAFIN ist) (NP (ART eine) (NN Psychologin))) ($. .),1,0,0
Sie selbst sagt von sich: \newline  \newline Ich bin eine Kindheits-forscherin!,(S (NP (PPER Sie) (ADV selbst)) (VVFIN sagt) (PP (APPR von) (PRF sich))) ($. :) (FM \newline) (FM  ) (FM \newline),1,0,0
Sie beschreibt in ihren Büchern Kindes-misshandlung.,(S (PPER Sie) (VVFIN beschreibt) (PP (APPR in) (PPOSAT ihren) (NN Büchern)) (NN Kindes-misshandlung)) ($. .),1,0,0
"Sie sagt: \newline  \newline Wenn diese Kinder Erwachsene sind, \newline dann sind sie verletzt in ihrem Sein: \newline Körperlich \newline Seelisch \newline Geistig",(S (PPER Sie) (VVFIN sagt)) ($. :) (FM \newline) (FM  ) (FM \newline),1,0,0
Viele Menschen trinken gern Getränke mit Alkohol.,(S (NP (PIAT Viele) (NN Menschen)) (VVFIN trinken) (ADV gern) (NP (NN Getränke) (PP (APPR mit) (NN Alkohol)))) ($. .),1,1,0
Das kann gefähr-lich sein.,(S (PDS Das) (VMFIN kann) (VP (ADJD gefähr-lich) (VAINF sein))) ($. .),1,0,0
Man kann abhängig werden vom Alkohol.,(S (PIS Man) (VMFIN kann) (VP (AP (ADJD abhängig)) (VAINF werden) (PP (APPRART vom) (NN Alkohol)))) ($. .),1,0,0
Das heißt:  \newline Man kann nicht aufhören mit Alkohol-trinken.,(S (PDS Das) (VVFIN heißt)) ($. :) ($.  ) (NE \newline),1,0,0
Man sagt dazu auch Sucht.,(S (PIS Man) (VVFIN sagt) (PROAV dazu) (NP (ADV auch) (NN Sucht))) ($. .),1,0,0
Die Alkohol-krankheit ist eine Krankheit.,(S (NP (ART Die) (NN Alkohol-krankheit)) (VAFIN ist) (NP (ART eine) (NN Krankheit))) ($. .),1,0,0
Menschen mit der Alkohol-krankheit nennt man: \newline Alkoholiker.,(S (NP (NN Menschen) (PP (APPR mit) (ART der) (NN Alkohol-krankheit))) (VVFIN nennt) (PIS man)) ($. :) (FM \newline),1,1,0
Ein Alkoholiker muss regel-mäßig Alkohol trinken.,(S (NP (ART Ein) (NN Alkoholiker)) (VMFIN muss) (VP (ADJD regel-mäßig) (NN Alkohol) (VVINF trinken))) ($. .),1,0,0
Sonst geht es dem Alkoholiker schlecht.,(S (ADV Sonst) (VVFIN geht) (PPER es) (NP (ART dem) (NN Alkoholiker)) (ADJD schlecht)) ($. .),1,0,0
Wenn man die Alkohol-krankheit hat braucht man Hilfe.,(S (KOUS Wenn) (PIS man) (NP (ART die) (NN Alkohol-krankheit)) (VAFIN hat) (VVFIN braucht) (PIS man) (NN Hilfe)) ($. .),1,0,0
Die Alkohol-krankheit kann man heilen.,(S (NP (ART Die) (NN Alkohol-krankheit)) (VMFIN kann) (PIS man) (VP (VVINF heilen))) ($. .),1,0,0
Dazu muss man einen Alkohol-entzug machen.,(S (PROAV Dazu) (VMFIN muss) (PIS man) (VP (NP (ART einen) (NN Alkohol-entzug)) (VVINF machen))) ($. .),1,0,0
Das nennt man auch Ent-giftung.,(S (PDS Das) (VVFIN nennt) (PIS man) (ADV auch) (NN Ent-giftung)) ($. .),1,0,0
Und man braucht eine Therapie.,(S (KON Und) (PIS man) (VVFIN braucht) (NP (ART eine) (NN Therapie))) ($. .),1,0,0
Der Alkoholiker muss lernen ohne Alkohol zu leben.,(S (NP (ART Der) (NN Alkoholiker)) (VMFIN muss) (VP (VVINF lernen) (VP (PP (APPR ohne) (NN Alkohol)) (VZ (PTKZU zu) (VVINF leben))))) ($. .),1,0,0
Alkohol-krankheit ist eine Krankheit.,(S (NN Alkohol-krankheit) (VAFIN ist) (NP (ART eine) (NN Krankheit))) ($. .),1,0,0
Und eine Sucht.,(S (KON Und) (NP (ART eine) (NN Sucht))) ($. .),0,0,0
Man kann nicht aufhören mit Alkohol-trinken.,(S (PIS Man) (VMFIN kann) (PTKNEG nicht) (VP (VVINF aufhören) (PP (APPR mit) (NN Alkohol-trinken)))) ($. .),1,0,0
Alkohol gehört zur Chemie.,(S (NN Alkohol) (VVFIN gehört) (PP (APPRART zur) (NN Chemie))) ($. .),1,0,0
Es gibt viele Alkohole.,(S (PPER Es) (VVFIN gibt) (NP (PIAT viele) (NN Alkohole))) ($. .),1,0,0
Ein Alkohol ist Ethanol.,(S (NP (ART Ein) (NN Alkohol)) (VAFIN ist) (NN Ethanol)) ($. .),1,0,0
Man sagt auch dazu: \newline Ethyl-alkohol.,(S (PIS Man) (VVFIN sagt) (PP (ADV auch) (PROAV dazu))) ($. :) (NP (FM \newline) (NN Ethyl-alkohol)) ($. .),1,0,0
Oder kurz: \newline Alkohol.,(DL (S (KON Oder) (ADJD kurz))) ($. :) (NP (ADJA \newline) (NN Alkohol)) ($. .),0,0,0
Ethanol ist eine Flüssigkeit.,(S (NN Ethanol) (VAFIN ist) (NP (ART eine) (NN Flüssigkeit))) ($. .),1,0,0
Ethanol hat keine Farbe.,(S (NE Ethanol) (VAFIN hat) (NP (PIAT keine) (NN Farbe))) ($. .),1,0,0
Ethanol kann brennen.,(S (NE Ethanol) (VMFIN kann) (VVINF brennen)) ($. .),1,0,0
Mit Ethanol kann man auch putzen.,(S (PP (APPR Mit) (NN Ethanol)) (VMFIN kann) (PIS man) (ADV auch) (VP (VVINF putzen))) ($. .),1,0,0
Ethanol ist in vielen Getränken.,(S (NN Ethanol) (VAFIN ist) (PP (APPR in) (PIAT vielen) (NN Getränken))) ($. .),1,0,0
Viele Menschen trinken gerne Alkohol.,(S (NP (PIAT Viele) (NN Menschen)) (VVFIN trinken) (ADV gerne) (NN Alkohol)) ($. .),1,0,0
Aber Alkohol kann gefährlich sein.,(S (KON Aber) (NN Alkohol) (VMFIN kann) (VP (ADJD gefährlich) (VAINF sein))) ($. .),1,0,0
Zu viel Alkohol ist Gift für den Körper.,(S (NP (AP (PTKA Zu) (PIAT viel)) (NN Alkohol)) (VAFIN ist) (NP (NN Gift) (PP (APPR für) (ART den) (NN Körper)))) ($. .),1,2,0
Das heißt: \newline Wenn man viel davon trinkt wird man krank.,(S (PDS Das) (VVFIN heißt)) ($. :) (NE \newline),1,0,0
Oft wird die Leber sehr krank.,(S (ADV Oft) (VAFIN wird) (NP (ART die) (NN Leber)) (AP (ADV sehr) (ADJD krank))) ($. .),1,0,0
